point_id;point_code;short_name;long_name;stop_id;point_role;gps_longitude;gps_latitude;valid_from;valid_until
1003799;HRLDXR02;01295;Harold's Cross Rd Rathgar Avenue;3550;ST;-6.279536;53.317875;27/05/2012;01/01/2036
1227;01227;01227;Kilmore Rd Castlekevin Road;101227;S;-6.215068;53.391138;27/05/2012;01/01/2036
1005709;MHDEKS02;01210;Malahide Road Posey Row;5090;ST;-6.177342;53.419032;27/05/2012;01/01/2036
1013617;NHUMHR02;00412;Northumberland Rd Haddington Road;6130;ST;-6.237257;53.335253;27/05/2012;01/01/2036
1766;01766;01766;Castle Ave Seafield Road West;101766;S;-6.204866;53.365079;27/05/2012;01/01/2036
1051547;GHSRDI01;02633;Greenhills Rd Airton Road;9550;ST;-6.355662;53.294088;27/05/2012;01/01/2036
1051595;GHSRDC02;02339;Greenhills Rd Park View;9360;ST;-6.351494;53.302569;27/05/2012;01/01/2036
5130;05130;05130;Butterfield Ave Charleville Square;105130;S;-6.29331;53.296695;27/05/2012;01/01/2036
121001;121001;00371;Irishtown Rd Gospel Hall;1210;S;-6.223075;53.338594;27/05/2012;01/01/2036
1258021;WELLLN01;06132;Wellington Road Rossmore Road;125;ST;-6.323312;53.295637;27/05/2012;01/01/2036
7066;07066;07066;Ballyroan Rd Butterfield Park;107066;S;-6.296284;53.287698;27/05/2012;01/01/2036
3202;03202;03202;Glenageary Rd George's Street;103202;S;-6.129959;53.288854;27/05/2012;01/01/2036
3730;03730;03730;Burrow Rd Beach Lane;103730;S;-6.116472;53.499295;27/05/2012;01/01/2036
1802;01802;01802;Cabra Road Carnlough Road;101802;S;-6.294509;53.361425;27/05/2012;01/01/2036
1192982;ESKRLN02;04327;Esker Lane Recycle Centre;2870;ST;-6.438301;53.351063;27/05/2012;01/01/2036
1258022;RATBOR01;00284;Rathbourne Avenue Rathbourne Way;10420;ST;-6.328361;53.377284;27/05/2012;01/01/2036
1178;01178;01178;Clonshaugh Industrial Estate;101178;S;-6.218843;53.403448;27/05/2012;01/01/2036
5141;05141;05141;Castle Ave Cemetery;105141;S;-6.205196;53.364739;27/05/2012;01/01/2036
1311940;CNNCNR01;03523;Ballyedmonduff Rd Brackloon House;18;ST;-6.220481;53.244973;27/05/2012;01/01/2036
1874123;KLMERD02;04473;Kilmore Rd Artane Castle;8787;ST;-6.214716;53.383946;27/05/2012;01/01/2036
1051596;ODBNRD02;02535;Old Bawn Rd Seskin View Rd;9601;ST;-6.358891;53.280996;27/05/2012;01/01/2036
4397;04397;04397;Ballinteer Ave Ballintyre Woods;104397;S;-6.251478;53.27554;27/05/2012;01/01/2036
2469;02469;02469;Ballycoolin Rd Blanchardstown Rd;102469;S;-6.367759;53.407721;27/05/2012;01/01/2036
1192984;NAVNRS01;07166;Navan Road Parkway Station;7580;ST;-6.345775;53.377095;27/05/2012;01/01/2036
4504;04504;04504;Royal Canal Ave Compass Court South;104504;S;-6.317257;53.37582;27/05/2012;01/01/2036
3220;03220;03220;Wyattville Road Loughlinstown Drive;103220;S;-6.13292;53.250722;27/05/2012;01/01/2036
1258023;JTWNRD02;04369;Jamestown Rd Finglas Business Park;3920;ST;-6.292429;53.39722;27/05/2012;01/01/2036
1820;01820;01820;Blackcourt Rd Sheephill Park;101820;S;-6.3751;53.40108;27/05/2012;01/01/2036
1065047;FGRDFV02;04543;Finglas Rd Wellmount Road;3072;ST;-6.296974;53.386245;27/05/2012;01/01/2036
1003839;SWRDLR01;01640;Swords Road Lorcan Road;8120;ST;-6.245975;53.392344;27/05/2012;01/01/2036
1312013;ARDEST02;04854;Ardee St Cork Street;150;ST;-6.279086;53.338152;27/05/2012;01/01/2036
2472;02472;02472;Clareville Road Larkfield Grove;102472;S;-6.28559;53.317675;27/05/2012;01/01/2036
1393033;KLCOLE07;04258;Newcastle Rd Leabeg House;4090;ST;-6.067615;53.084227;27/05/2012;01/01/2036
1196;01196;01196;Malahide Road Elm Mount Road;101196;S;-6.214529;53.378021;27/05/2012;01/01/2036
3231;03231;03231;Rochestown Ave Granitefield Manor;103231;S;-6.141943;53.270151;27/05/2012;01/01/2036
1013683;MHDESR02;03580;Dublin Rd Swords Road;5120;ST;-6.173842;53.443252;27/05/2012;01/01/2036
7202;07202;07202;Skerries Townparks;107202;S;-6.114184;53.575342;27/05/2012;01/01/2036
3767;03767;03767;Station Road Rogerstown Lane;103767;S;-6.148484;53.522029;27/05/2012;01/01/2036
1258024;CHTWUP02;01035;Churchtown Rd Beaumont Avenue;1710;ST;-6.256112;53.2951;27/05/2012;01/01/2036
555;00555;00555;Howth Road Howth Castle;100555;S;-6.079465;53.38889;27/05/2012;01/01/2036
1229385;LCANCR02;03888;Celbridge Rd Flyover;4900;ST;-6.462618;53.355122;27/05/2012;01/01/2036
4526;04526;04526;Ashington Avenue Priory;104526;S;-6.315238;53.372132;27/05/2012;01/01/2036
3242;03242;03242;Sallynoggin Road Jellystone Park Nursery;103242;S;-6.145374;53.275355;27/05/2012;01/01/2036
3770;03770;03770;Station Road Rush Station;103770;S;-6.144568;53.521392;27/05/2012;01/01/2036
30;00030;00030;Ventry Park John Paul II Park;100030;S;-6.304578;53.370321;27/05/2012;01/01/2036
278503;278503;02508;East Wall Rd Docklands;2785;S;-6.225802;53.352859;27/05/2012;01/01/2036
2494;02494;02494;Stannaway Rd Clonfert Road;102494;S;-6.300562;53.319645;27/05/2012;01/01/2036
2398;02398;02398;Fortfield Rd Fortfield;102398;S;-6.29975;53.305238;27/05/2012;01/01/2036
1165343;PMNTHS02;04559;Peamount Rd Golf Club;6520;ST;-6.471516;53.317529;27/05/2012;01/01/2036
998;00998;00998;Oscar Traynor Rd Armstrong Walk;100998;S;-6.209777;53.393572;27/05/2012;01/01/2036
1211654;GGRYSC01;03238;Glenageary Rd Holmstown Avenue;3300;ST;-6.133717;53.283299;27/05/2012;01/01/2036
7120;07120;07120;Adamstown Ave Castlegate Way;107120;S;-6.463501;53.337555;27/05/2012;01/01/2036
473;00473;00473;Rock Road Grotto Avenue;100473;S;-6.197366;53.309241;27/05/2012;01/01/2036
3160;03160;03160;Deansgrange Rd Cemetery;103160;S;-6.166731;53.284373;27/05/2012;01/01/2036
5096;05096;05096;Rathbeale Road Balcartie Road;105096;S;-6.253535;53.472636;27/05/2012;01/01/2036
1232;01232;01232;Castletimon Rd Castletimon Drive;101232;S;-6.230467;53.395284;27/05/2012;01/01/2036
1760;01760;01760;Seapark Rd Mount Prospect Ave;101760;S;-6.187732;53.365969;27/05/2012;01/01/2036
1136129;WARDRD02;07023;St. Margaret's Est Church;8350;ST;-6.30095;53.430867;27/05/2012;01/01/2036
7139;07139;07139;Griffeen Avenue Griffeen Glen;107139;S;-6.437287;53.339278;27/05/2012;01/01/2036
1013755;CLTFVA02;01747;Clontarf Rd Church;1900;ST;-6.196816;53.35931;27/05/2012;01/01/2036
4455;04455;04455;Ailesbury Road Merlyn Park;104455;S;-6.21394;53.320614;27/05/2012;01/01/2036
1229326;STWLSC02;03900;Dublin Rd Celbridge Football Park;7740;ST;-6.511585;53.343401;27/05/2012;01/01/2036
1243;01243;01243;Greencastle Rd Greencastle Ave;101243;S;-6.199907;53.394895;27/05/2012;01/01/2036
3179;03179;03179;Leopardstown Rd Racecourse;103179;S;-6.198611;53.2731;27/05/2012;01/01/2036
495;00495;00495;Westland Row Pearse Station;100495;S;-6.249726;53.343586;27/05/2012;01/01/2036
1086361;BFRTCL01;02689;Ballyfermot Rd Blackditch Drive;510;ST;-6.363732;53.343102;27/05/2012;01/01/2036
3814;03814;03814;Balbriggan Rd Barnageeragh Road;103814;S;-6.148611;53.585546;27/05/2012;01/01/2036
661001;661001;00368;Pigeon House Rd ESB Simulater Centre;6610;S;-6.205888;53.341408;27/05/2012;01/01/2036
1086362;DCESRD01;02704;Decies Road Ranville Road;2430;ST;-6.345339;53.339242;27/05/2012;01/01/2036
4466;04466;04466;Glenwood Rd Springdale Road;104466;S;-6.189766;53.388417;27/05/2012;01/01/2036
602;00602;00602;Howth Road Cill Eanna;100602;S;-6.183034;53.378145;27/05/2012;01/01/2036
4994;04994;04994;Warrenstown Warrenstown Way;104994;S;-6.386433;53.400938;27/05/2012;01/01/2036
1254;01254;01254;Bunratty Road Barrycourt Road;101254;S;-6.211351;53.395111;27/05/2012;01/01/2036
7153;07153;07153;Walkinstown Dr Walkinstown Parade;107153;S;-6.335054;53.322234;27/05/2012;01/01/2036
3825;03825;03825;Rush Road Hacketstown Cottages;103825;S;-6.103405;53.562343;27/05/2012;01/01/2036
1136130;CHTOWN01;07132;Charlestown Rd Charlestown S.C.;10490;ST;-6.304283;53.403087;27/05/2012;01/01/2036
1311899;STMYRD01;02331;St. Mary's Road Kildare Road;7650;ST;-6.31777;53.324566;27/05/2012;01/01/2036
4477;04477;04477;Kilmacud Rd Killmacud Road;104477;S;-6.205155;53.288974;27/05/2012;01/01/2036
613;00613;00613;Howth Road Clontarf Road;100613;S;-6.226796;53.364613;27/05/2012;01/01/2036
1793;01793;01793;Millbrook Rd Tonlegee Road;101793;S;-6.178685;53.391677;27/05/2012;01/01/2036
3836;03836;03836;Skerries Road Golden Ridge;103836;S;-6.091186;53.52335;27/05/2012;01/01/2036
1908;01908;01908;Old Cabra Rd Cabra Drive;101908;S;-6.291248;53.358684;27/05/2012;01/01/2036
479501;479501;00635;Glenwood Rd Tonlegee Avenue;4795;S;-6.183906;53.389017;27/05/2012;01/01/2036
431002;431002;00442;Kilmacud Rd Dale Drive;4310;S;-6.211998;53.289207;27/05/2012;01/01/2036
107;00107;00107;Balbutcher Lane Crannogue Road;100107;S;-6.279674;53.402031;27/05/2012;01/01/2036
1193139;CPTOWN01;04575;Carpenterstown Rd Shopping Centre;1460;ST;-6.388613;53.372659;27/05/2012;01/01/2036
3322;03322;03322;Kilmacud Rd GAA Club;103322;S;-6.201756;53.288129;27/05/2012;01/01/2036
3850;03850;03850;Station Lane Rush Station;103850;S;-6.146218;53.521632;27/05/2012;01/01/2036
110;00110;00110;Balbutcher Lane Balcurris Gardens;100110;S;-6.268683;53.397937;27/05/2012;01/01/2036
1003876;SWRDTL02;01627;Swords Road Santry Retail Park;8170;ST;-6.237873;53.408245;27/05/2012;01/01/2036
3858;03858;03858;Lusk Road Bridetree;103858;S;-6.177955;53.511012;27/05/2012;01/01/2036
118;00118;00118;Griffith Avenue Sherkin Gardens;100118;S;-6.253568;53.376639;27/05/2012;01/01/2036
182003;182003;01903;Clonsilla Rd Broadway Road;1820;S;-6.38745;53.385248;27/05/2012;01/01/2036
3861;03861;03861;Lusk Road Balleally Lane;103861;S;-6.187338;53.504827;27/05/2012;01/01/2036
1257910;FORTPK01;02406;Fortfield Park Templeville Road;3160;ST;-6.30481;53.301987;27/05/2012;01/01/2036
1668;01668;01668;Castleknock Rd Old Race Course;101668;S;-6.340293;53.370838;27/05/2012;01/01/2036
1257911;RATHRD02;00072;Ventry Drive Ratoath Road;6920;ST;-6.304241;53.368961;27/05/2012;01/01/2036
7039;07039;07039;Portrane Burrow Road;107039;S;-6.109983;53.493526;27/05/2012;01/01/2036
384;00384;00384;Strand Road Lea Road;100384;S;-6.210172;53.331609;27/05/2012;01/01/2036
1143;01143;01143;Knocklyon Road Knockaire;101143;S;-6.313366;53.283413;27/05/2012;01/01/2036
3079;03079;03079;Newtown Ave Seapoint Avenue;103079;S;-6.17058;53.298306;27/05/2012;01/01/2036
1086482;NARDBB02;01954;Naas Road Muirfield Drive;5720;ST;-6.334787;53.328768;27/05/2012;01/01/2036
1229389;CAPTHL01;03996;Captain's Hill Newtown Park;1440;ST;-6.486351;53.371161;27/05/2012;01/01/2036
4366;04366;04366;Clune Road McKee Road;104366;S;-6.294788;53.39121;27/05/2012;01/01/2036
1312053;JTWNHE01;03482;Enniskerry Rd Jamestown House;3880;ST;-6.200907;53.246145;27/05/2012;01/01/2036
4894;04894;04894;Diswellstown Rd Luttrellstown Court;104894;S;-6.398374;53.372101;27/05/2012;01/01/2036
1005710;RVRVLY02;03710;River Valley Rd River Valley Lawn;7010;ST;-6.231213;53.452048;27/05/2012;01/01/2036
3082;03082;03082;Carysfort Avenue Frascati Road;103082;S;-6.178085;53.30045;27/05/2012;01/01/2036
1030298;BRNADV02;01135;Marian Road Marian Park;9061;ST;-6.297276;53.293439;27/05/2012;01/01/2036
1013480;SGR-SK;00791;St. Stephen's Green Stephens Court;7700;ST;-6.2571;53.339;27/05/2012;01/01/2036
5125;05125;05125;Kingswood Road Brownsbarn Court;105125;S;-6.419425;53.2985;27/05/2012;01/01/2036
4377;04377;04377;McKee Road Sycamore Road;104377;S;-6.29001;53.394423;27/05/2012;01/01/2036
513;00513;00513;Summerhill Rd Rutland Street;100513;S;-6.254001;53.355253;27/05/2012;01/01/2036
3093;03093;03093;Avondale Road Cluny Grove;103093;S;-6.130109;53.270337;27/05/2012;01/01/2036
1001413;FASVRR01;00073;Faussagh Avenue Broombridge Road;2950;ST;-6.300705;53.367387;27/05/2012;01/01/2036
1693;01693;01693;Castleknock Rd Castleknock Gate;101693;S;-6.343975;53.370456;27/05/2012;01/01/2036
7064;07064;07064;Marian Road Anne Devlin Park;107064;S;-6.298174;53.289508;27/05/2012;01/01/2036
1247185;BSWNSC07;02959;Blanchardstown Centre Bus Interchange;1030;ST;-6.392124;53.394148;27/05/2012;01/01/2036
5136;05136;05136;Newcastle Rd Gorse Hill;105136;S;-6.067387;53.077886;27/05/2012;01/01/2036
1312056;SDFRBC01;02837;Sandyford Rd Clonard Road;7270;ST;-6.230661;53.277357;27/05/2012;01/01/2036
292002;292002;04332;Nutgrove Way Nutgrove;2920;S;-6.268781;53.290082;27/05/2012;01/01/2036
1013482;GCTLRD01;01248;Greencastle Rd Coolock I.E.;3450;ST;-6.197159;53.392987;27/05/2012;01/01/2036
3208;03208;03208;Sallynoggin St. Kevin's School;103208;S;-6.138595;53.276136;27/05/2012;01/01/2036
3736;03736;03736;Portrane Burrow Road;103736;S;-6.111642;53.493365;27/05/2012;01/01/2036
2452;02452;02452;St. Peter's Road Roundabout;102452;S;-6.332013;53.316145;27/05/2012;01/01/2036
1013806;ANGRAN02;00912;Warrenhouse Moyclare;110;ST;-6.125384;53.393485;27/05/2012;01/01/2036
1165392;NANGCT02;02167;Nangor Road Golf Club;5770;ST;-6.435652;53.318214;27/05/2012;01/01/2036
1312057;WOODSC02;03497;Woodside Rd Slate Cabin Lane;14;ST;-6.234769;53.261787;27/05/2012;01/01/2036
1013808;MAGMHD01;03640;Swords Road Lawson Spinney;5310;ST;-6.174117;53.446291;27/05/2012;01/01/2036
7075;07075;07075;Celbridge Rd Griffin Rath;107075;S;-6.580188;53.369695;27/05/2012;01/01/2036
3211;03211;03211;Rochestown Pk Beechwood Lawn;103211;S;-6.138017;53.271285;27/05/2012;01/01/2036
1399;01399;01399;Kildare Road Clonard Road;101399;S;-6.30541;53.325133;27/05/2012;01/01/2036
1311785;BTDRA01;03184;Blackthorn Drive Moreen Avenue;4514;ST;-6.223826;53.276191;27/05/2012;01/01/2036
1257944;LKRDSR02;02392;Kimmage Rd Larkfield Park;4810;ST;-6.291233;53.318889;27/05/2012;01/01/2036
1193079;BGRDRD01;02763;Belgard Road Belgard Castle;870;ST;-6.386276;53.308805;27/05/2012;01/01/2036
4086;04086;04086;Enniskerry Rd Garden Centre;104086;S;-6.185488;53.228463;27/05/2012;01/01/2036
222;00222;00222;Shanliss Rd Shanowen Road;100222;S;-6.24928;53.389939;27/05/2012;01/01/2036
1193069;BHLLCR01;06133;Laraghcon Barnhill Cross Roads;750;ST;-6.452137;53.360766;27/05/2012;01/01/2036
3801;03801;03801;North Cliff Heights Mourne Drive;103801;S;-6.12746;53.580639;27/05/2012;01/01/2036
1065001;FGLSDI01;01535;Finglas Rd Willows;3000;ST;-6.282358;53.372309;27/05/2012;01/01/2036
1013618;KSTRDR02;00531;Howth Road Demesne;4240;ST;-6.201438;53.373219;27/05/2012;01/01/2036
3809;03809;03809;Old Market Green Pump Lane;103809;S;-6.179485;53.606118;27/05/2012;01/01/2036
4981;04981;04981;Pearse Villas Rochestown Park;104981;S;-6.137593;53.272661;27/05/2012;01/01/2036
1241;01241;01241;Ardlea Road Chanel Avenue;101241;S;-6.209074;53.385875;27/05/2012;01/01/2036
4989;04989;04989;Damastown Drive I.B.M.;104989;S;-6.417876;53.419115;27/05/2012;01/01/2036
1005698;MHDEBR02;06115;Malahide Road Belcamp Lane;5020;ST;-6.184196;53.400125;27/05/2012;01/01/2036
3177;03177;03177;Leopardstown Rd Foxrock Manor;103177;S;-6.188414;53.276109;27/05/2012;01/01/2036
1249;01249;01249;Coolock Drive Greencastle Rd;101249;S;-6.201234;53.395177;27/05/2012;01/01/2036
1777;01777;01777;Seafield Ave Mount Prospect Ave;101777;S;-6.191028;53.365301;27/05/2012;01/01/2036
1311950;SMNTAV01;02808;Sandymount Ave DART Station;7300;ST;-6.221254;53.32757;27/05/2012;01/01/2036
3812;03812;03812;Skerries Road Fancourt Heights;103812;S;-6.170835;53.605151;27/05/2012;01/01/2036
1065002;DRMUPG01;00044;Drumcondra Rd Homefarm Road;2611;ST;-6.25211;53.373016;27/05/2012;01/01/2036
1311951;GOATRD01;03018;Drummartin Rd Drummartin Terrace;3340;ST;-6.228633;53.292017;27/05/2012;01/01/2036
1788;01788;01788;Millbrook Rd Tonlegee Road;101788;S;-6.178791;53.391614;27/05/2012;01/01/2036
1013530;GLYNGR01;04692;Glin Road Glin Sports Centre;3330;ST;-6.205306;53.400243;27/05/2012;01/01/2036
1001428;CMLNHP02;01419;Errigal Rd Brandon Road;2290;ST;-6.322887;53.327707;27/05/2012;01/01/2036
7159;07159;07159;Ongar Ongar Village;107159;S;-6.442734;53.396599;27/05/2012;01/01/2036
1339100;RDWNUP02;04211;Greystones Rd Rathdown Upper;11001;ST;-6.093081;53.172039;27/05/2012;01/01/2036
3823;03823;03823;Holmpatrick Rugby Club;103823;S;-6.101564;53.572762;27/05/2012;01/01/2036
1051518;CAMART02;04023;Blessington Rd Hayland's Sand Pits;9860;ST;-6.525188;53.178605;27/05/2012;01/01/2036
611;00611;00611;Howth Road Hollybrook Park;100611;S;-6.218892;53.366748;27/05/2012;01/01/2036
2019;02019;02019;Kill Lane Foxrock Avenue;102019;S;-6.169878;53.275885;27/05/2012;01/01/2036
1247074;LCANVL04;02224;Main St Lucan Adamstown Road;4910;ST;-6.449734;53.357274;27/05/2012;01/01/2036
3191;03191;03191;Leopardstown Rd Foxrock Manor;103191;S;-6.188313;53.276309;27/05/2012;01/01/2036
1001401;ASHING02;04322;Ashington Park Ashington Gardens;190;ST;-6.311247;53.373433;27/05/2012;01/01/2036
1013531;SUTNST01;04381;Sutton DART Station;8030;ST;-6.116171;53.391689;27/05/2012;01/01/2036
1799;01799;01799;McAuley Road Mask Crescent;101799;S;-6.196649;53.383056;27/05/2012;01/01/2036
3834;03834;03834;Skerries Road Palmer Road;103834;S;-6.09147;53.530937;27/05/2012;01/01/2036
2022;02022;02022;Kill Lane Kill Abbey;102022;S;-6.161568;53.28006;27/05/2012;01/01/2036
1311952;BCRSRD02;03282;Enniskerry Rd Ballycorus Rd;450;ST;-6.193419;53.23574;27/05/2012;01/01/2036
1013533;PLMSPK01;00896;Palmerston Park Dartry Road;6420;ST;-6.261328;53.313366;27/05/2012;01/01/2036
1013534;COTTBR02;00940;Coast Road Moyne Cottages;2210;ST;-6.134716;53.406547;27/05/2012;01/01/2036
949004;949004;02755;Cookstown Rd Belgard Heights;9490;S;-6.383233;53.300041;27/05/2012;01/01/2036
7173;07173;07173;Old Market Green Pump Lane;107173;S;-6.179533;53.606188;27/05/2012;01/01/2036
1311954;CKSHBA02;00861;Roebuck Road Bird Avenue;1840;ST;-6.235983;53.305113;27/05/2012;01/01/2036
1045891;NAULRD02;00816;Naul Road Cloghran Roundabout;8095;ST;-6.229995;53.434914;27/05/2012;01/01/2036
1051519;KILTEL01;04060;Blessington Rd Kilteel Road;9830;ST;-6.506733;53.197422;27/05/2012;01/01/2036
1193070;NAVNVH01;01698;Navan Road Ashtown Grove;5860;ST;-6.323699;53.369567;27/05/2012;01/01/2036
2033;02033;02033;York Road Knapton Court;102033;S;-6.143383;53.291476;27/05/2012;01/01/2036
105;00105;00105;Balbutcher Lane Poppintree Park Lane;100105;S;-6.28176;53.402928;27/05/2012;01/01/2036
1311955;KDREBR02;01441;Kildare Road Bangor Road;4130;ST;-6.303013;53.324868;27/05/2012;01/01/2036
566;00566;00566;Thormanby Road Kitestown Rd;100566;S;-6.056111;53.373768;27/05/2012;01/01/2036
1030183;STRDHH02;00694;Greenfield Rd Strand Road;7955;ST;-6.100251;53.384357;27/05/2012;01/01/2036
4537;04537;04537;Hazelwood Est Roundabout;104537;S;-6.401957;53.31087;27/05/2012;01/01/2036
3253;03253;03253;Johnstown Rd Pottery Road;103253;S;-6.147476;53.267839;27/05/2012;01/01/2036
2609;02609;02609;Avonmore Road Avonmore Drive;102609;S;-6.343098;53.284779;27/05/2012;01/01/2036
1229386;BALYHE04;03886;Leixlip Rd Primrose Lane;320;ST;-6.454145;53.355684;27/05/2012;01/01/2036
3781;03781;03781;Skerries Rd Rush Hands Lane;103781;S;-6.091268;53.523405;27/05/2012;01/01/2036
7224;07224;07224;Ballycoolin Rd Stadium Business Park;107224;S;-6.338436;53.397811;27/05/2012;01/01/2036
3789;03789;03789;Skerries Road Water Works;103789;S;-6.101899;53.554129;27/05/2012;01/01/2036
1051597;TLGHNP02;02555;Blessington Rd Bancroft Road;8200;ST;-6.349533;53.288712;27/05/2012;01/01/2036
4012;04012;04012;Blessington Rd Lisheen View;104012;S;-6.473195;53.217233;27/05/2012;01/01/2036
4548;04548;04548;Finglas Place Main Street;104548;S;-6.296042;53.386234;27/05/2012;01/01/2036
3264;03264;03264;Johnstown Rd Johnstown Park;103264;S;-6.145966;53.268884;27/05/2012;01/01/2036
3792;03792;03792;Skerries Hacketstown Pk;103792;S;-6.102459;53.56606;27/05/2012;01/01/2036
1336;01336;01336;Terenure Rd Fergus Road;101336;S;-6.2841;53.308861;27/05/2012;01/01/2036
588;00588;00588;Dublin Rd Sutton Park;100588;S;-6.127579;53.388051;27/05/2012;01/01/2036
4551;04551;04551;Woodford Wk Yellow Meadows Drive;104551;S;-6.382909;53.326488;27/05/2012;01/01/2036
3275;03275;03275;Brighton Road Cnoc Ard;103275;S;-6.171036;53.258133;27/05/2012;01/01/2036
1192985;BHRSMB01;01709;Blackhorse Ave Glenbeigh Avenue;930;ST;-6.297037;53.356862;27/05/2012;01/01/2036
1875;01875;01875;Huntstown Way Pinebrook;101875;S;-6.41516;53.398264;27/05/2012;01/01/2036
7246;07246;07246;Clongriffin Station Way;107246;S;-6.157233;53.402759;27/05/2012;01/01/2036
706;00706;00706;Thormanby Road Lighthouse;100706;S;-6.06003;53.36659;27/05/2012;01/01/2036
1192987;BSWNRS04;01869;Blakestown Way Sheepmoor Avenue;1060;ST;-6.399954;53.396246;27/05/2012;01/01/2036
1312014;BEMDCE01;03521;Ballyedmonduff Rd Brook Meadow;19;ST;-6.2221;53.237561;27/05/2012;01/01/2036
1136062;LKFDGN01;02471;Larkfield Pk Larkfield Avenue;4550;ST;-6.289146;53.318787;27/05/2012;01/01/2036
4573;04573;04573;Diswellstown Rd Burnell Park Avenue;104573;S;-6.387781;53.370603;27/05/2012;01/01/2036
3929;03929;03929;Celbridge Main St St. Patrick's Park;103929;S;-6.539087;53.338988;27/05/2012;01/01/2036
2117;02117;02117;Ninth Lock Road Station Road;102117;S;-6.397942;53.329836;27/05/2012;01/01/2036
2645;02645;02645;Lally Rd Seven Oaks;102645;S;-6.330751;53.341692;27/05/2012;01/01/2036
1051598;PKSTDS02;02386;New Street South Kevin Street;9220;ST;-6.272319;53.337903;27/05/2012;01/01/2036
1001442;CABRDA02;00060;Cabra Road Quarry Road;1380;ST;-6.289249;53.361235;27/05/2012;01/01/2036
1051599;TNODHE01;04063;Blessington Rd Golden Hill;9810;ST;-6.495009;53.205866;27/05/2012;01/01/2036
1897;01897;01897;Clonsilla Rd The Thatch;101897;S;-6.410332;53.383109;27/05/2012;01/01/2036
2120;02120;02120;Neilstown Road Collinstown Park School;102120;S;-6.399397;53.341162;27/05/2012;01/01/2036
4056;04056;04056;Blessington Rd Finlay Breton;104056;S;-6.489561;53.208567;27/05/2012;01/01/2036
720;00720;00720;Carrickbrack Rd Duncarraig;100720;S;-6.097409;53.381935;27/05/2012;01/01/2036
2128;02128;02128;Neilstown Road Neilstown Avenue;102128;S;-6.399736;53.339668;27/05/2012;01/01/2036
1132140;HARTCR03;01506;Finglas Rd Prospect Road;3570;ST;-6.272371;53.366768;27/05/2012;01/01/2036
1372;01372;01372;Goldenbridge Ave Kickham Road;101372;S;-6.309862;53.338104;27/05/2012;01/01/2036
728;00728;00728;Grange Road Church Of Holy Trinity;100728;S;-6.163472;53.395314;27/05/2012;01/01/2036
1051600;HUDSON02;04004;Blessington Rd The Pines;9710;ST;-6.454223;53.250031;27/05/2012;01/01/2036
7271;07271;07271;Newcastle Rd Newcastle Middle;107271;S;-6.067744;53.076569;27/05/2012;01/01/2036
1312016;JTWNSN01;03483;Enniskerry Rd Jamestown Golf Club;3870;ST;-6.207511;53.249609;27/05/2012;01/01/2036
1051601;RENDT02;00395;Ringsend Road Barrow Street;10520;ST;-6.235422;53.341957;27/05/2012;01/01/2036
1001447;NAVNBR02;04523;Kinvara Avenue Navan Road;5800;ST;-6.31734;53.369138;27/05/2012;01/01/2036
7279;07279;07279;Dublin Rd Woodstock Road;107279;S;-6.105388;53.085074;27/05/2012;01/01/2036
3415;03415;03415;Nangor Road Golf Course;103415;S;-6.444997;53.318537;27/05/2012;01/01/2036
1086447;BFRTCH02;02655;Ballyfermot Rd Ballyfermot Parade;500;ST;-6.352837;53.342137;27/05/2012;01/01/2036
1405;01405;01405;Clogher Road Parnell Road;101405;S;-6.284398;53.329814;27/05/2012;01/01/2036
6020;06020;06020;Cherry Orchard Ave Barnville Green;106020;S;-6.37662;53.33807;27/05/2012;01/01/2036
129;00129;00129;Glasnevin Avenue Glasnevin Drive;100129;S;-6.271413;53.389888;27/05/2012;01/01/2036
657;00657;00657;All Saints Park All Saints Road;100657;S;-6.178925;53.375549;27/05/2012;01/01/2036
1003877;KELYCR02;01287;Harrington Street Synge Street;3940;ST;-6.266112;53.332482;27/05/2012;01/01/2036
1944;01944;01944;Old Kilmainham Prospect Terrace;101944;S;-6.303595;53.340671;27/05/2012;01/01/2036
660;00660;00660;Ballycoolin Rd Blanchardstown Rd;100660;S;-6.368051;53.407766;27/05/2012;01/01/2036
1030223;CRCHRD02;00551;Howth Road Church Road;1690;ST;-6.104629;53.390038;27/05/2012;01/01/2036
6039;06039;06039;Waterville Terrace Snugborough Road;106039;S;-6.375846;53.391552;27/05/2012;01/01/2036
2703;02703;02703;Thomond Road Cremona Road;102703;S;-6.346516;53.338289;27/05/2012;01/01/2036
1311904;ODONRD02;04855;O'Donovan Rd Thomas Road;6230;ST;-6.279298;53.334598;27/05/2012;01/01/2036
2071;02071;02071;Fosters Avenue Stillorgan Road;102071;S;-6.209939;53.303045;27/05/2012;01/01/2036
1955;01955;01955;Naas Road Carriglea I.E.;101955;S;-6.337906;53.327938;27/05/2012;01/01/2036
1013762;SEAMT02;03628;The Hill Malahide GAA Club;772;ST;-6.151717;53.438779;27/05/2012;01/01/2036
143;00143;00143;Glasnevin Avenue Willow Park Avenue;100143;S;-6.269241;53.389871;27/05/2012;01/01/2036
6042;06042;06042;Rathmines Road Church Avenue;106042;S;-6.26496;53.32014;27/05/2012;01/01/2036
1013763;CLTFOR02;01746;Clontarf Rd Oultan Road;1890;ST;-6.202736;53.360254;27/05/2012;01/01/2036
4114;04114;04114;Enniskerry Rd Glencree Road;104114;S;-6.172729;53.192884;27/05/2012;01/01/2036
679;00679;00679;Greenfield Rd Santa Sabina School;100679;S;-6.102962;53.386454;27/05/2012;01/01/2036
4642;04642;04642;Jobstown Rd Cloonmore;104642;S;-6.403411;53.280837;27/05/2012;01/01/2036
2714;02714;02714;Ballyfermot Rd Markievicz Park;102714;S;-6.341855;53.341908;27/05/2012;01/01/2036
1430;01430;01430;Mourne Rd Benbulbin Road;101430;S;-6.311129;53.333574;27/05/2012;01/01/2036
1013764;MTPRSA01;01757;Mount Prospect Ave Park Lawn;5600;ST;-6.182224;53.368623;27/05/2012;01/01/2036
1136132;STNYRD02;02487;Stannaway Rd Devenish Road;7750;ST;-6.295275;53.321809;27/05/2012;01/01/2036
1193140;OLUCWC01;02243;Lucan Road Glenaulin;6280;ST;-6.355685;53.351967;27/05/2012;01/01/2036
3894;03894;03894;Cooldrinagh Lane Cemetery;103894;S;-6.528303;53.33991;27/05/2012;01/01/2036
2082;02082;02082;Fosters Avenue North Avenue;102082;S;-6.213002;53.301959;27/05/2012;01/01/2036
1438;01438;01438;St. Thomas Road Clarence Mangan Road;101438;S;-6.279407;53.33638;27/05/2012;01/01/2036
1013765;PRWOOD01;01266;Priorswood Rd St. Francis Church;6710;ST;-6.204718;53.402049;27/05/2012;01/01/2036
154;00154;00154;Old Finglas Rd St. Brigid's School;100154;S;-6.275539;53.377263;27/05/2012;01/01/2036
1311905;PBRKRD03;02798;Pembroke Road Northumberland Road;6550;ST;-6.235865;53.331999;27/05/2012;01/01/2036
1005775;STBGRB02;01198;Malahide Road Mornington Grove;7570;ST;-6.206905;53.382509;27/05/2012;01/01/2036
2725;02725;02725;Ballymount Rd Westgate Business Park;102725;S;-6.354455;53.310827;27/05/2012;01/01/2036
1339089;BOGLRD04;04301;Greystones Rd House On Hill;1100;ST;-6.093693;53.17231;27/05/2012;01/01/2036
1257989;FASVQR01;04501;Faussagh Road Quarry Road;2940;ST;-6.287106;53.364742;27/05/2012;01/01/2036
