point_id;point_code;short_name;long_name;stop_id;point_role;gps_longitude;gps_latitude;valid_from;valid_until
1268;01268;01268;Priorswood Rd Belcamp Avenue;101268;S;-6.197884;53.399885;27/05/2012;01/01/2036
1796;01796;01796;McAuley Park McAuley Drive;101796;S;-6.19115;53.381788;27/05/2012;01/01/2036
1030306;STMRCV02;00704;Carrickbrack Rd Stella Maris Convent;7760;ST;-6.06639;53.366724;27/05/2012;01/01/2036
2027;02027;02027;Monkstown Farm Monkstown Avenue;102027;S;-6.15684;53.286958;27/05/2012;01/01/2036
1258065;BFRDWK01;02853;Broadford Rd Stone Masons Way;1260;ST;-6.260687;53.280838;27/05/2012;01/01/2036
538005;538005;00479;Merrion Road Merrion Centre;5380;S;-6.213389;53.319136;27/05/2012;01/01/2036
627;00627;00627;Edenmore Grove Edenmore Green;100627;S;-6.181983;53.385409;27/05/2012;01/01/2036
1051482;WILLPO02;00429;Rock Road Blackrock Clinic;8810;ST;-6.18713;53.304709;27/05/2012;01/01/2036
1165361;CVERTN01;05121;Green Isle Road Naas Road;1640;ST;-6.413912;53.30447;27/05/2012;01/01/2036
7178;07178;07178;Ballymount Rd Tynan Hall Avenue;107178;S;-6.372898;53.307025;27/05/2012;01/01/2036
1165362;BSHFHS01;05122;Green Isle Road Manor Drive;1340;ST;-6.407339;53.306974;27/05/2012;01/01/2036
102;00102;00102;Balbutcher Lane Silloge Road;100102;S;-6.267708;53.397768;27/05/2012;01/01/2036
61501;61501;00098;Sandyhill Ave Sandyhill Gardens;615;S;-6.272894;53.395543;27/05/2012;01/01/2036
630;00630;00630;Springdale Rd Edenmore Avenue;100630;S;-6.189302;53.387243;27/05/2012;01/01/2036
638;00638;00638;Springdale Rd Edenmore Avenue;100638;S;-6.188356;53.386758;27/05/2012;01/01/2036
6009;06009;06009;Santry Avenue Hazelwood;106009;S;-6.257095;53.400207;27/05/2012;01/01/2036
1193058;NSCTGR02;01253;Kilmore Rd Tranquility Grove;6120;ST;-6.214705;53.393908;27/05/2012;01/01/2036
4609;04609;04609;Griffeen Road Elm Wood;104609;S;-6.432858;53.345935;27/05/2012;01/01/2036
1211609;SNOGPV02;03210;Pearse Street Pearse Villas;7190;ST;-6.139535;53.273497;27/05/2012;01/01/2036
7175;07175;07175;Skerries Road Ardgillan Demesne;107175;S;-6.154401;53.589542;30/11/2011;01/01/2036
2563;02563;02563;Killinarden Heights Opposite Donomore Avenue;102563;S;-6.387758;53.273141;30/11/2011;01/01/2036
646;00646;00646;Harmonstown Road Harmonstown Train Station;100646;S;-6.191507;53.379257;30/11/2011;01/01/2036
7197;07197;07197;Holywell Holywell Ward;107197;S;-6.21228;53.445007;30/11/2011;01/01/2036
7304;07304;07304;Moyglare Road At GAA Maynooth;107304;S;-6.597771;53.389219;30/11/2011;01/01/2036
4628;04628;04628;Griffeen Road Moy Glas Park;104628;S;-6.432154;53.343359;30/11/2011;01/01/2036
7315;07315;07315;Accomodation Road Easton Park;107315;S;-6.50761;53.367503;30/11/2011;01/01/2036
994;00994;00994;Oscar Traynor Road Opposite Dundaniel Road;100994;S;-6.222872;53.397888;30/11/2011;01/01/2036
3681;03681;03681;Rathbeale Road Junction Brackenstown Avenue;103681;S;-6.228433;53.461219;30/11/2011;01/01/2036
3683;03683;03683;Glassmore Park Opposite Abbeylea Avenue;103683;S;-6.232967;53.461449;30/11/2011;01/01/2036
1755;01755;01755;Mount Prospect Ave Seapark Apartments;101755;S;-6.1871;53.3663;30/11/2011;01/01/2036
5094;05094;05094;Blackthorn Slip Road Luas Line;105094;S;-6.210209;53.280092;30/11/2011;01/01/2036
2525;02525;02525;Bohernabreena Road Allenton Estate;102525;S;-6.353926;53.274662;30/11/2011;01/01/2036
1780;01780;01780;Castle Avenue Junction Vernon Avenue;101780;S;-6.203041;53.37002;30/11/2011;01/01/2036
7151;07151;07151;St. Margaret's Road Near IKEA;107151;S;-6.273723;53.406263;30/11/2011;01/01/2036
1263;01263;01263;Finglas Place Junction Ballygall Crescent;101263;S;-6.29386;53.386172;30/11/2011;01/01/2036
622;00622;00622;Harmonstown Road Junction Rosemount Avenue;100622;S;-6.195439;53.37779;30/11/2011;01/01/2036
6015;06015;06015;Rathingle Road Cherry Avenue;106015;S;-6.238552;53.448326;30/11/2011;01/01/2036
2375;02375;02375;Greenhills Road Opposite Calmount Park;102375;S;-6.340832;53.313586;30/11/2011;01/01/2036
4946;04946;04946;Manor Place Junction Oxmanstown Road;104946;S;-6.287271;53.351216;30/11/2011;01/01/2036
7105;07105;07105;Tyrrelstown Belgree Boulevard;107105;S;-6.387867;53.421355;30/11/2011;01/01/2036
4429;04429;04429;Airways Ind. Est Boeing Road;104429;S;-6.233537;53.404998;30/11/2011;01/01/2036
7019;07019;07019;Distributor Road  Ongar Junction Castlegrange Green;107019;S;-6.43106;53.398292;11/12/2011;01/01/2036
7005;07005;07005;Test Street Test Town Opposite Test Centre;107005;S;-6.2291;53.3948;11/12/2011;01/01/2036
3853;03853;03853;Station Road Rathmore Road;103853;S;-6.160697;53.524232;27/05/2012;01/01/2036
1229352;CBRIDG02;03909;Maynooth Road Beatty Park;1610;ST;-6.541909;53.346786;27/05/2012;01/01/2036
641;00641;00641;Edenmore Grove Edenmore Green;100641;S;-6.182368;53.385825;27/05/2012;01/01/2036
6012;06012;06012;New Nangor Road Fonthill Rd;106012;S;-6.40557;53.323602;27/05/2012;01/01/2036
7192;07192;07192;Balbutcher Lane Balbutcher Way;107192;S;-6.275184;53.403817;27/05/2012;01/01/2036
1400;01400;01400;Clonmacnoise Rd Bangor Circle;101400;S;-6.299811;53.323622;27/05/2012;01/01/2036
1165363;MILLBG02;03453;Mill Road Spring Bank;5400;ST;-6.4528;53.282951;27/05/2012;01/01/2036
1001465;GLTYSR02;01453;Galtymore Rd Slievenamon Road;3240;ST;-6.306738;53.334537;27/05/2012;01/01/2036
1352903;GYSTST07;04270;Kilcoole Rd Mountain View;3470;ST;-6.06818;53.117156;27/05/2012;01/01/2036
3864;03864;03864;Rathbeale Road Abbylea Ave;103864;S;-6.234114;53.463996;27/05/2012;01/01/2036
1003834;ABST-OW;00288;Abbey St Irish Life Mall;4870;ST;-6.255625;53.349129;27/05/2012;01/01/2036
124;00124;00124;Shangan Road Londale Way;100124;S;-6.260606;53.394918;27/05/2012;01/01/2036
6023;06023;06023;Barnville Green Cherry Orchard Ave;106023;S;-6.37885;53.3373;27/05/2012;01/01/2036
4623;04623;04623;Griffeen Avenue Griffeen Road;104623;S;-6.430613;53.340422;27/05/2012;01/01/2036
1312010;RECKFT02;02929;Edmondstown Rd Golf Club;3310;ST;-6.299012;53.271828;27/05/2012;01/01/2036
1229355;CODHRD01;03998;Leixlip Mill Lane;2130;ST;-6.487337;53.364488;27/05/2012;01/01/2036
1165364;SCTAMA02;03397;Newcastle Orchard Grove;7210;ST;-6.496616;53.299636;27/05/2012;01/01/2036
1005727;BVILPK01;01274;Malahide Road Tonlegee Road;1290;ST;-6.197962;53.388932;27/05/2012;01/01/2036
7318;07318;07318;Cruiserath Rd Ballycoolin Road;107318;S;-6.368426;53.409911;27/05/2012;01/01/2036
4106;04106;04106;Kilmolin Road Golf Club;104106;S;-6.192828;53.196218;27/05/2012;01/01/2036
2706;02706;02706;Decies Road Garryowen Road;102706;S;-6.341684;53.340035;27/05/2012;01/01/2036
1258068;WAINRD02;02397;Fortfield Rd College Drive;8620;ST;-6.300848;53.306586;27/05/2012;01/01/2036
1051484;HILLS01;04073;Blessington Rd The Pines;9730;ST;-6.453773;53.2506;27/05/2012;01/01/2036
3358;03358;03358;Clonmacnoise Rd Lismore Road;103358;S;-6.303387;53.321127;27/05/2012;01/01/2036
7321;07321;07321;Ballyogan Rd Glencairn;107321;S;-6.2047;53.260386;27/05/2012;01/01/2036
2074;02074;02074;North Avenue Greenfield Road;102074;S;-6.211159;53.297996;27/05/2012;01/01/2036
146;00146;00146;Mobhi Road Na Fianna;100146;S;-6.265044;53.375162;27/05/2012;01/01/2036
4645;04645;04645;Fortunestown Way Swiftbrook Ave;104645;S;-6.406004;53.284848;27/05/2012;01/01/2036
1005716;RUSHST02;03778;Rush Sandy Road;7140;ST;-6.097034;53.522738;27/05/2012;01/01/2036
1051485;BMUNTR01;00039;Ballymun Road The Rise;640;ST;-6.265649;53.380416;27/05/2012;01/01/2036
2717;02717;02717;West Road Seaview Avenue;102717;S;-6.237453;53.357234;27/05/2012;01/01/2036
1433;01433;01433;Slievenamon Rd Brickfields Park;101433;S;-6.305778;53.332571;27/05/2012;01/01/2036
3897;03897;03897;Celbridge Rd Backweston Park;103897;S;-6.499733;53.345874;27/05/2012;01/01/2036
1969;01969;01969;Monastery Rd Monastery Walk;101969;S;-6.384259;53.319807;27/05/2012;01/01/2036
1258070;BRRDCC01;01036;Braemor Road Churchtown Rd;1140;ST;-6.259045;53.295809;27/05/2012;01/01/2036
2720;02720;02720;Church Road St Mary's Road North;102720;S;-6.233093;53.352052;27/05/2012;01/01/2036
1229356;DCMRCH02;03904;Dublin Rd Riding School;2520;ST;-6.528238;53.339932;27/05/2012;01/01/2036
1258071;BRPKMC02;01042;Braemor Park Mount Carmel Hospital;1130;ST;-6.264018;53.304332;27/05/2012;01/01/2036
7343;07343;07343;Cruiserath Rd Business Park;107343;S;-6.361198;53.412834;27/05/2012;01/01/2036
1339125;BOGLRD07;04296;Rathdown Road Blacklion Manor;1100;ST;-6.081673;53.152379;27/05/2012;01/01/2036
1193060;LCANSQ01;04620;Newcastle Rd Esker Drive;4880;ST;-6.450887;53.347585;27/05/2012;01/01/2036
1136090;NEWTHE02;01553;The Ward Road Newtown Cottages;6020;ST;-6.305252;53.425211;27/05/2012;01/01/2036
168;00168;00168;Beneavin Rd Beneavin Park;100168;S;-6.284414;53.389255;27/05/2012;01/01/2036
2006;02006;02006;Anglesea Road Old Belvedere Rugby Football Club;102006;S;-6.230357;53.32158;30/11/2011;01/01/2036
3829;03829;03829;Skerries Road Loughshinny Cross;103829;S;-6.101251;53.547307;30/11/2011;01/01/2036
4484;04484;04484;Swords Road Omni Park Shopping Centre;104484;S;-6.247928;53.39308;30/11/2011;01/01/2036
7171;07171;07171;Station Road Junction Dublin Road;107171;S;-6.164858;53.52534;30/11/2011;01/01/2036
7179;07179;07179;Tallaght The Square;107179;S;-6.372541;53.285607;30/11/2011;01/01/2036
103;00103;00103;Balbutcher Lane Junction Belclare Crescent;100103;S;-6.269933;53.397912;30/11/2011;01/01/2036
7182;07182;07182;Tallaght The Square;107182;S;-6.373498;53.286058;30/11/2011;01/01/2036
6013;06013;06013;New Nangor Road Roundabout;106013;S;-6.405669;53.32406;30/11/2011;01/01/2036
7300;07300;07300;Straffan Road Before Glenroyal Hotel;107300;S;-6.589936;53.380743;30/11/2011;01/01/2036
3865;03865;03865;Rathbeale Road Glen Ellan Walk;103865;S;-6.237325;53.465847;30/11/2011;01/01/2036
7308;07308;07308;Straffan Court Rd At Meadowbrook Court;107308;S;-6.596761;53.371382;30/11/2011;01/01/2036
3348;03348;03348;Sybil Hill Road Sacred Heart Residence;103348;S;-6.194444;53.374081;30/11/2011;01/01/2036
7311;07311;07311;Parson Street Opposite house no 3 parsons Lodge;107311;S;-6.594794;53.378383;30/11/2011;01/01/2036
6040;06040;06040;Errigal Gardens Hospital Staff Car Park;106040;S;-6.320771;53.326578;30/11/2011;01/01/2036
3364;03364;03364;Brookwood Avenue Junction Brookwood Grove;103364;S;-6.201166;53.380805;30/11/2011;01/01/2036
6363;06363;06363;St. Margaret's Road Hampton Wood;106363;S;-6.287935;53.406136;30/11/2011;01/01/2036
5087;05087;05087;Enniskerry Road Church Of Ireland School;105087;S;-6.199225;53.243814;30/11/2011;01/01/2036
2529;02529;02529;Bohernabreena Road Opposite Church;102529;S;-6.360043;53.263431;30/11/2011;01/01/2036
2821;02821;02821;Dundrum Road junction Columbanus Road;102821;S;-6.24563;53.301294;19/02/2012;01/01/2036
9002;9002;02267;Alexandra Road Junction Branch Road South;90;S;-6.21238;53.350723;26/02/2012;01/01/2036
4407;04407;04407;Victoria Quay Guinness Store;104407;S;-6.286196;53.346604;04/03/2012;01/01/2036
7509;07509;07509;fettercairn Road 30 Metres west of PLP35;107509;S;-6.389994;53.292952;04/03/2012;01/01/2036
65002;65002;00094;Ballymun Road Silloge Road;650;S;-6.264372;53.396033;27/05/2012;01/01/2036
696;00696;00696;Carrickbrack Rd Old Castle Avenue;100696;S;-6.094345;53.380519;27/05/2012;01/01/2036
120002;120002;00358;Sean Moore Road Bremen Road;1200;S;-6.217079;53.339026;27/05/2012;01/01/2036
4667;04667;04667;Fonthill Rd St. John's;104667;S;-6.401319;53.317476;27/05/2012;01/01/2036
2739;02739;02739;Ballymount Rd St. Killian's School;102739;S;-6.370029;53.307238;27/05/2012;01/01/2036
1455;01455;01455;Slievenamon Rd Galtymore Rd;101455;S;-6.305767;53.335386;27/05/2012;01/01/2036
7354;07354;07354;Naas Road Monastery Road;107354;S;-6.375066;53.316965;27/05/2012;01/01/2036
6070;06070;06070;Decies Road O'Hogan Road;106070;S;-6.337027;53.340888;27/05/2012;01/01/2036
1013514;HTOWN01;00324;Harristown Bus Garage;10450;ST;-6.278626;53.417721;27/05/2012;01/01/2036
4670;04670;04670;Deansrath Nangor Road;104670;S;-6.422392;53.321223;27/05/2012;01/01/2036
6078;06078;06078;Dundaniel Road Oscar Traynor Rd;106078;S;-6.224202;53.397233;27/05/2012;01/01/2036
1005700;MHDEKP02;01197;Malahide Road Kilmore Road;4980;ST;-6.211743;53.37923;27/05/2012;01/01/2036
1258072;SDFRMR01;00885;Sandford Road Hollybank Ave;7220;ST;-6.246269;53.321254;27/05/2012;01/01/2036
1193062;CSRDEE01;04630;Castle Rd Earlsfort;685;ST;-6.418771;53.344658;27/05/2012;01/01/2036
3394;03394;03394;Peamount Rd Newcastle;103394;S;-6.501063;53.300567;27/05/2012;01/01/2036
1466;01466;01466;Galtymore Rd Slievenamon Road;101466;S;-6.306228;53.334526;27/05/2012;01/01/2036
1994;01994;01994;Mount Brown St. James's Hospital;101994;S;-6.299366;53.341421;27/05/2012;01/01/2036
825;00825;00825;Carnlough Road St. Finbar's Road;100825;S;-6.296914;53.370423;27/05/2012;01/01/2036
4689;04689;04689;Fonthill Rd Coldcut Road;104689;S;-6.405685;53.347707;27/05/2012;01/01/2036
193;00193;00193;Mckee Road Clune Road;100193;S;-6.294091;53.391191;27/05/2012;01/01/2036
1051486;MPWDRD01;02750;Cookstown Rd Maplewood Road;9520;ST;-6.389507;53.28655;27/05/2012;01/01/2036
3512;03512;03512;Ballybrack Rd Walsh's Lane;103512;S;-6.235399;53.221926;27/05/2012;01/01/2036
1051487;WLKAVE01;02775;Walkinstown Ave Long Mile Road;9440;ST;-6.341091;53.322772;27/05/2012;01/01/2036
1874121;BEAURD02;00255;Beaumont Road Coolgreena Road;8786;ST;-6.231518;53.385588;27/05/2012;01/01/2036
308;00308;00308;Oscar Square Thomas Road;100308;S;-6.279518;53.336769;27/05/2012;01/01/2036
1013515;BDLVIL04;00914;Baldoyle Strand Road;310;ST;-6.127496;53.398753;27/05/2012;01/01/2036
1086492;PKWEST01;06030;Parkwest Ave Park West Road;7545;ST;-6.375344;53.332658;27/05/2012;01/01/2036
1488;01488;01488;Griffith Avenue St. Mary's College;101488;S;-6.234675;53.37109;27/05/2012;01/01/2036
1051488;BLYRDK01;02764;Ballymount Rd Belgard Road;9470;ST;-6.37667;53.304366;27/05/2012;01/01/2036
1499;01499;01499;Brian Road Shelmartin Avenue;101499;S;-6.237281;53.365773;27/05/2012;01/01/2036
3006;03006;03006;Ballycullen Rd Ballycullen Drive;103006;S;-6.331246;53.278453;27/05/2012;01/01/2036
1606;01606;01606;St. Helena's Road Valeview Drive;101606;S;-6.306426;53.380373;27/05/2012;01/01/2036
322;00322;00322;Ballymun Road Gulliver's Retail Park;100322;S;-6.265346;53.404251;27/05/2012;01/01/2036
7505;07505;07505;Bealing Boulevard Tyrrellstown Way;107505;S;-6.386163;53.417573;27/05/2012;01/01/2036
1193064;FNSTAB01;03368;Esker Road Finnstown Abbey;3090;ST;-6.449429;53.344542;27/05/2012;01/01/2036
850;00850;00850;Chelmsford Road Sallymount Avenue;100850;S;-6.251113;53.326121;27/05/2012;01/01/2036
858;00858;00858;Clonskeagh Rd Beech Hill;100858;S;-6.238286;53.314088;27/05/2012;01/01/2036
3017;03017;03017;Goatstown Rd Hollywood Park;103017;S;-6.231105;53.294341;27/05/2012;01/01/2036
2261;02261;02261;Church Road Church Court;102261;S;-6.232396;53.352639;27/05/2012;01/01/2036
1051490;GLEAJC01;04072;Blessington Rd Glenareen;9740;ST;-6.455548;53.248643;27/05/2012;01/01/2036
2797;02797;02797;Pembroke Road Northumberland Road;102797;S;-6.236504;53.332392;27/05/2012;01/01/2036
4304;04304;04304;Vevay Road Newcourt Road;104304;S;-6.102654;53.189365;27/05/2012;01/01/2036
869;00869;00869;Roebuck Road Louvain;100869;S;-6.222433;53.300039;27/05/2012;01/01/2036
147;00147;00147;Mobhi Road Dean Swift Bridge;100147;S;-6.265828;53.372481;30/11/2011;01/01/2036
161;00161;00161;Fitzsmaurice Road Junction Ballygall Road East;100161;S;-6.277089;53.382601;30/11/2011;01/01/2036
172;00172;00172;Griffith Parade Junction Fitzmaurice Road;100172;S;-6.278562;53.38266;30/11/2011;01/01/2036
7355;07355;07355;Naas Road m50 roundabout at slip road for Luas Park and Ride;107355;S;-6.376823;53.316203;30/11/2011;01/01/2036
2226;02226;02226;Westmanstown Collins Bridge;102226;S;-6.456507;53.370266;30/11/2011;01/01/2036
6093;06093;06093;Kylemore Park North Junction Kylemore Road;106093;S;-6.348244;53.33603;30/11/2011;01/01/2036
4165;04165;04165;Putland Road Presentation College;104165;S;-6.100945;53.20427;30/11/2011;01/01/2036
4808;04808;04808;Springdale Road Jennings Funeral Home;104808;S;-6.185654;53.384797;30/11/2011;01/01/2036
2776;02776;02776;Walkinstown Avenue Opposite Walkinstown Avenue Park;102776;S;-6.33893;53.320888;30/11/2011;01/01/2036
3302;03302;03302;Brewery Road Near Woodford estate;103302;S;-6.199037;53.275448;30/11/2011;01/01/2036
109;00109;00109;Balbutcher Lane Burren Court;100109;S;-6.270603;53.398101;30/11/2011;01/01/2036
6008;06008;06008;Santry Avenue Junction Forestwood Avenue;106008;S;-6.25768;53.400067;30/11/2011;01/01/2036
7306;07306;07306;Moyglare Road Opposite Maynooth Post Primary School;107306;S;-6.594831;53.384144;30/11/2011;01/01/2036
6022;06022;06022;Kingswood Avenue Junction Kingswood Road;106022;S;-6.418432;53.295167;30/11/2011;01/01/2036
662;00662;00662;Collins Avenue East Opposite Clontarf Golf Club;100662;S;-6.212622;53.373871;30/11/2011;01/01/2036
4105;04105;04105;Kilmolin Road Hill View;104105;S;-6.191716;53.195348;30/11/2011;01/01/2036
1229376;BDWDST01;02233;Lucan Road Chalet Gardens;460;ST;-6.435157;53.360088;27/05/2012;01/01/2036
1051572;WBSTLE04;02385;Patrick Street Back Avenue;9250;ST;-6.271997;53.342264;27/05/2012;01/01/2036
4926;04926;04926;Forest Road Dublin Road;104926;S;-6.224649;53.45447;27/05/2012;01/01/2036
3642;03642;03642;Estuary Road Sacred Heart Church;103642;S;-6.181274;53.455127;27/05/2012;01/01/2036
430;00430;00430;Mount Merrion Ave Sydney Avenue;100430;S;-6.185889;53.301484;27/05/2012;01/01/2036
1211582;MMAVGR01;00465;Mount Merrion Ave Clanfadda Wood;5590;ST;-6.196147;53.298845;27/05/2012;01/01/2036
5053;05053;05053;Swords Road Airport Runway;105053;S;-6.235459;53.419129;27/05/2012;01/01/2036
1051573;RWPKSB02;03116;Rowan Pk Maynard;6071;ST;-6.167164;53.289923;27/05/2012;01/01/2036
1045900;PSQW-PE;00004;Parnell Square Rotunda Hospital;3910;ST;-6.264166;53.352567;27/05/2012;01/01/2036
4937;04937;04937;McKee Avenue Seamus Ennis Rd;104937;S;-6.300498;53.39267;27/05/2012;01/01/2036
1013652;PNTRIE1;04781;Poppintree Pk I.D.A. Poppintree;6640;ST;-6.283973;53.401775;27/05/2012;01/01/2036
3653;03653;03653;Mountgorry Way Feltrim Retail Park;103653;S;-6.204497;53.448654;27/05/2012;01/01/2036
1725;01725;01725;Clontarf Rd Doyle's Lane;101725;S;-6.177061;53.363754;27/05/2012;01/01/2036
1211584;CHERWD02;05046;Wyattville Road Druid Valley;1670;ST;-6.140624;53.245209;27/05/2012;01/01/2036
1093;01093;01093;Whitehall Rd Manor Grove;101093;S;-6.311652;53.309973;27/05/2012;01/01/2036
5064;05064;05064;Dublin Rd Old Market Green;105064;S;-6.183931;53.605935;27/05/2012;01/01/2036
1051575;TLGHTS09;04342;Tallaght The Square;8190;ST;-6.373008;53.286079;27/05/2012;01/01/2036
3136;03136;03136;Bray Road Cottsfoot;103136;S;-6.12733;53.237732;27/05/2012;01/01/2036
1013654;COSTRD02;03623;Coast Road Mayfair;1940;ST;-6.143737;53.450645;27/05/2012;01/01/2036
1001444;FASVCL02;00063;Faussagh Avenue Carnlough Road;2960;ST;-6.292729;53.366788;27/05/2012;01/01/2036
1013655;EDENQ-EJ;00298;Eden Quay Liberty Hall;2800;ST;-6.256371;53.348177;27/05/2012;01/01/2036
1258061;CCOURT01;03258;Bray Road Westminister Road;2180;ST;-6.171963;53.272539;27/05/2012;01/01/2036
6359;06359;06359;Swords Road Seatown Road;106359;S;-6.213275;53.462225;27/05/2012;01/01/2036
5075;05075;05075;Rathbeale Road Watery Lane;105075;S;-6.223567;53.459666;27/05/2012;01/01/2036
1311922;BEMDHE02;03506;Ballyedmonduff Rd Ballyedmonduff House;10810;ST;-6.22169;53.232729;27/05/2012;01/01/2036
3147;03147;03147;Bray Road Kilbogget Park;103147;S;-6.145489;53.255272;27/05/2012;01/01/2036
1219;01219;01219;Malahide Road Danieli Road;101219;S;-6.208343;53.381259;27/05/2012;01/01/2036
2391;02391;02391;Kimmage Rd Priory Road;102391;S;-6.286414;53.320195;27/05/2012;01/01/2036
7118;07118;07118;Adamstown Ave Castlegate Way;107118;S;-6.464002;53.337339;27/05/2012;01/01/2036
991;00991;00991;Santry Avenue Swords Road;100991;S;-6.24644;53.397702;27/05/2012;01/01/2036
2399;02399;02399;Fortfield Park Fortfield Road;102399;S;-6.299506;53.303525;27/05/2012;01/01/2036
1003859;HRLDXG02;01291;Harold's Cross Rd Le Vere Terrace;3540;ST;-6.276298;53.328443;27/05/2012;01/01/2036
2470;02470;02470;Ballycoolin Rd Ballycoolin Ind Est;102470;S;-6.365503;53.406701;27/05/2012;01/01/2036
1826;01826;01826;Lady's Well Road Parslickstown Ave;101826;S;-6.395005;53.405958;27/05/2012;01/01/2036
14;00014;00014;Dorset St Eccles Place;100014;S;-6.262724;53.358537;27/05/2012;01/01/2036
542;00542;00542;Dublin Rd Kilbarrack Road;100542;S;-6.146262;53.383656;27/05/2012;01/01/2036
2478;02478;02478;Grosvenor Road Rathgar Road;102478;S;-6.269726;53.320534;27/05/2012;01/01/2036
1194;01194;01194;Collins Ave Belton Park Road;101194;S;-6.225101;53.377524;27/05/2012;01/01/2036
5165;05165;05165;Donabate Willowbrook;105165;S;-6.13938;53.491373;27/05/2012;01/01/2036
2481;02481;02481;Kenilworth Square Kenilworth Square;102481;S;-6.27808;53.318736;27/05/2012;01/01/2036
25;00025;00025;Home Farm Road Rathlin Road;100025;S;-6.263611;53.375903;27/05/2012;01/01/2036
1003860;KDST-SC;00747;Kildare Street Archbishop Statue;4150;ST;-6.255697;53.339928;27/05/2012;01/01/2036
2489;02489;02489;Stannaway Rd Clonfert Road;102489;S;-6.300427;53.319569;27/05/2012;01/01/2036
4524;04524;04524;Ashington Avenue Priory;104524;S;-6.315726;53.371673;27/05/2012;01/01/2036
1005764;MHDEFL01;03647;Malahide Road Feltrim Lane;5060;ST;-6.176737;53.432713;27/05/2012;01/01/2036
1003861;FRVIEW02;00523;Marino Mart Marino College;2910;ST;-6.231608;53.364281;27/05/2012;01/01/2036
1013627;CLTFDT02;01749;Clontarf Rd Bus Garage;1911;ST;-6.190544;53.358564;27/05/2012;01/01/2036
1001407;OCS- OR;00271;O'Connell St Abbey Street;6227;ST;-6.259539;53.348584;27/05/2012;01/01/2036
1141;01141;01141;Knocklyon Road Coolamber Court;101141;S;-6.311006;53.289916;27/05/2012;01/01/2036
3077;03077;03077;Monkstown Rd Montpellier Manor;103077;S;-6.168441;53.29592;27/05/2012;01/01/2036
7048;07048;07048;Ongar Ongar Green;107048;S;-6.44268;53.393011;27/05/2012;01/01/2036
1051658;COCTGE02;04024;Blessington Rd Hayland's Sand Pits;9870;ST;-6.526951;53.175876;27/05/2012;01/01/2036
1051659;MPWDRF01;02622;Cookstown Rd Fortunestown Way;9530;ST;-6.392585;53.2838;27/05/2012;01/01/2036
3712;03712;03712;North Street Swords Castle;103712;S;-6.217203;53.463651;27/05/2012;01/01/2036
500;00500;00500;Ballybough Rd Foster Terrace;100500;S;-6.246263;53.359031;27/05/2012;01/01/2036
2436;02436;02436;Kimmage Road West Lorcan O'Toole Park;102436;S;-6.308932;53.3137;27/05/2012;01/01/2036
1001426;CMLNLC02;01409;Crumlin Road Sundrive Road;2320;ST;-6.297446;53.330376;27/05/2012;01/01/2036
1086418;PGENHS02;00359;Sean Moore Road Pine Road;6610;ST;-6.214162;53.340715;27/05/2012;01/01/2036
1680;01680;01680;Carpenterstown Pk Sycamore Avenue;101680;S;-6.389491;53.375606;27/05/2012;01/01/2036
1136083;PRANHM01;03739;Portrane Hospital;6685;ST;-6.112885;53.487669;27/05/2012;01/01/2036
1086419;LMRWA02;02727;Long Mile Rd Drimnagh Castle;4721;ST;-6.332882;53.323756;27/05/2012;01/01/2036
1086420;WDRDWK02;01964;Woodford Wk Woodford Avenue;8880;ST;-6.37846;53.323206;27/05/2012;01/01/2036
1247178;GFENVY02;04608;Griffeen Road Griffeen Glen;3480;ST;-6.432309;53.342411;27/05/2012;01/01/2036
1013628;ALRDMC02;01224;Ardlea Road Maryfield Crescent;165;ST;-6.210923;53.386644;27/05/2012;01/01/2036
1312045;BREWRD01;03317;Brewery Rd Leopardstown Rd;10370;ST;-6.200635;53.273888;27/05/2012;01/01/2036
5134;05134;05134;Lally Rd Landen Road;105134;S;-6.330199;53.341686;27/05/2012;01/01/2036
1699;01699;01699;Navan Road Baggot Road;101699;S;-6.321289;53.368739;27/05/2012;01/01/2036
1312046;EDMSPO01;02940;Edmondstown Rd Edmonstown Green;3260;ST;-6.297489;53.2803;27/05/2012;01/01/2036
3734;03734;03734;Burrow Rd The Castle;103734;S;-6.114738;53.497258;27/05/2012;01/01/2036
2450;02450;02450;Armagh Road St. Agnes School;102450;S;-6.30766;53.320224;27/05/2012;01/01/2036
4386;04386;04386;Watermill Drive Watermill Avenue;104386;S;-6.175149;53.378052;27/05/2012;01/01/2036
1003857;SWRDSH02;00220;Swords Road Shantalla Road;8160;ST;-6.244967;53.387935;27/05/2012;01/01/2036
2458;02458;02458;St. James's Road Limekiln Avenue;102458;S;-6.337166;53.307185;27/05/2012;01/01/2036
2986;02986;02986;Bushy Park Rd Meadowbank;102986;S;-6.276573;53.307597;27/05/2012;01/01/2036
2605;02605;02605;Old Bawn Rd Watergate;102605;S;-6.360703;53.284855;27/05/2012;01/01/2036
1321;01321;01321;Grange Road Aranleigh;101321;S;-6.282179;53.292462;27/05/2012;01/01/2036
1193004;BSWNVL03;01845;Navan Road Morgan's Place;1045;ST;-6.352699;53.37902;27/05/2012;01/01/2036
3785;03785;03785;Skerries Road Clifflands;103785;S;-6.09275;53.539231;27/05/2012;01/01/2036
1857;01857;01857;Mount Vw Rd Church;101857;S;-6.407839;53.391163;27/05/2012;01/01/2036
3260;03260;03260;Old Bray Road Mart Lane;103260;S;-6.166636;53.26969;27/05/2012;01/01/2036
2616;02616;02616;Old Bawn Rd St. Maelruan's Park;102616;S;-6.360649;53.284662;27/05/2012;01/01/2036
1193007;NAVNGS02;01660;Navan Road Nephin Road;5840;ST;-6.309313;53.365167;27/05/2012;01/01/2036
1051450;TNODHS02;04014;Blessington Rd June Blake Garden;9800;ST;-6.484496;53.211636;27/05/2012;01/01/2036
4929;04929;04929;Citywest Rd Saggart Abbey;104929;S;-6.421408;53.280798;27/05/2012;01/01/2036
3645;03645;03645;Dublin Rd Malahide Castle;103645;S;-6.176291;53.440533;27/05/2012;01/01/2036
969;00969;00969;Oscar Traynor Rd Northside;100969;S;-6.215472;53.395675;27/05/2012;01/01/2036
4932;04932;04932;Citywest Rd Magna Drive;104932;S;-6.420487;53.278855;27/05/2012;01/01/2036
1510360;PSQW-PH;00007;Parnell Square Rotunda Hospital;3910;ST;-6.264562;53.352836;27/05/2012;01/01/2036
3128;03128;03128;Old Bray Road Brennanstown Road;103128;S;-6.151051;53.261294;27/05/2012;01/01/2036
3656;03656;03656;Mountgorry Way Feltrim Retail Park;103656;S;-6.2044;53.448542;27/05/2012;01/01/2036
86002;86002;02618;Belgard Road Mayberry Road;860;S;-6.371352;53.298731;27/05/2012;01/01/2036
1257972;ABBYRD02;02026;Monkstown Ave Stradbrook Rd;81;ST;-6.159704;53.286649;27/05/2012;01/01/2036
1086336;BFRTMZ01;02715;Ballyfermot Rd O'Hogan Road;520;ST;-6.33859;53.342552;27/05/2012;01/01/2036
444;00444;00444;Kilmacud Rd Kilmacud Park;100444;S;-6.207564;53.288057;27/05/2012;01/01/2036
