point_id;point_code;short_name;long_name;stop_id;point_role;gps_longitude;gps_latitude;valid_from;valid_until
1013562;SHLL:2-2;SHLL:2-2;SHLL:2-2;;DT;-6.2515;53.355833;01/01/1970;01/01/2036
1013645;SHLL:2-1;SHLL:2-1;SHLL:2-1;;DT;-6.254683;53.355566;01/01/1970;01/01/2036
1064602;SKSTN:2-1;SKSTN:2-1;SKSTN:2-1;;DT;-6.118932;53.574325;01/01/1970;01/01/2036
1064603;CTARF:2-2;CTARF:2-2;CTARF:2-2;;DT;-6.1904;53.358014;01/01/1970;01/01/2036
1064604;REND:2-3;REND:2-3;REND:2-3;;DT;-6.233497;53.341891;01/01/1970;01/01/2036
1064600;REND:2-1;REND:2-1;REND:2-1;;DT;-6.233627;53.342312;01/01/1970;01/01/2036
1064601;PHIB:2-1;PHIB:2-1;PHIB:2-1;;DT;-6.274648;53.353121;01/01/1970;01/01/2036
1064610;REND:2-2;REND:2-2;REND:2-2;;DT;-6.234305;53.341977;01/01/1970;01/01/2036
1064608;HARS:2-1;HARS:2-1;HARS:2-1;;DT;-6.276968;53.416381;01/01/1970;01/01/2036
1064611;PHIB:2-2;PHIB:2-2;PHIB:2-2;;DT;-6.274281;53.35366;01/01/1970;01/01/2036
1064616;HARS:2-2;HARS:2-2;HARS:2-2;;DT;-6.278473;53.416946;01/01/1970;01/01/2036
1064615;CTARF:2-1;CTARF:2-1;CTARF:2-1;;DT;-6.191264;53.359001;01/01/1970;01/01/2036
1064613;CONY:2-2;CONY:2-2;CONY:2-2;;DT;-6.29679;53.480683;29/04/2010;01/01/2036
1064606;CONY:2-1;CONY:2-1;CONY:2-1;;DT;-6.296989;53.347684;29/04/2010;01/01/2036
1064605;CONY:2-3;CONY:2-3;CONY:2-3;;DT;-6.297557;53.3481;29/04/2010;01/01/2036
1003883;MBROST01;06207;Marlborough Street Abbey Theatre;5230;ST;-6.257532;53.34849;28/07/2010;01/01/2036
1051434;TLGHSB04;02550;Tallaght Road Cheeverstown House;8240;ST;-6.31498;53.294793;28/07/2010;01/01/2036
1086330;NEWLCR01;02176;Naas Road Newlands Cross;6000;ST;-6.387646;53.313859;28/07/2010;01/01/2036
1086332;GRCABP05;07230;Grange Castle Cuisine de France;792;ST;-6.453763;53.322371;28/07/2010;01/01/2036
1013699;BMNTHL08;04597;Beaumont Hospital Main entrance;820;ST;-6.224084;53.390242;28/07/2010;01/01/2036
1005707;MHDEKS01;01212;Malahide Road Kinsealy School;5090;ST;-6.176726;53.420557;28/07/2010;01/01/2036
1013670;MKSMED02;03618;Coast Road Monks Meadow;5510;ST;-6.123055;53.438748;28/07/2010;01/01/2036
1013804;BMNTHL07;00253;Beaumont Hospital Main entrance;820;ST;-6.224379;53.389942;28/07/2010;01/01/2036
1013714;CFRDSX02;03599;Strand Road Portmarnock Village;2090;ST;-6.136458;53.421649;28/07/2010;01/01/2036
1051617;FTRBED01;07280;Ballymore Eustace Barrack Street;10000;ST;-6.610799;53.132761;28/07/2010;01/01/2036
1005695;MHDEDC02;01208;Malahide Road St. Doulough's Church;5110;ST;-6.178657;53.414298;28/07/2010;01/01/2036
1005728;BVILPK02;01200;Malahide Road Chanel College;1290;ST;-6.20106;53.386975;28/07/2010;01/01/2036
1086386;SPIDPK01;02670;Spiddal Road Spiddal Park;7540;ST;-6.36754;53.340388;28/07/2010;01/01/2036
1013719;STANCH01;03633;Church Street St. Andrew's Church;771;ST;-6.153224;53.448385;28/07/2010;01/01/2036
1086391;KINGHS02;02213;Lucan Road Liffey Valley;4410;ST;-6.39203;53.355711;28/07/2010;01/01/2036
1013455;STRDRD02;00943;Strand Road Portmarnock Bridge;7950;ST;-6.142127;53.418292;28/07/2010;01/01/2036
1009894;FELTHA01;06310;Holywell Link Road;10700;ST;-6.211027;53.443563;28/07/2010;01/01/2036
1030284;HWTHMP01;00574;Thormanby Road Asgard Park;3810;ST;-6.064253;53.384614;28/07/2010;01/01/2036
1013705;COTTBR01;00948;Coast Road Moyne Bridge;2210;ST;-6.134263;53.40614;28/07/2010;01/01/2036
1004525;HEUSST01;04319;Heuston Station Victoria Quay;10180;ST;-6.292013;53.346763;28/07/2010;01/01/2036
1013607;BDYLAP02;00938;Coast Road Old Race Course;290;ST;-6.130356;53.40154;28/07/2010;01/01/2036
1001408;MARINO02;01490;Griffith Avenue Ard Scoil Ris;5260;ST;-6.228549;53.368867;28/07/2010;01/01/2036
1051571;PBRKLR01;00487;Pembroke Road American Embassy;6550;ST;-6.233865;53.3308;28/07/2010;01/01/2036
1013575;MYNEBG02;00941;Coast Road Moyne Bridge;5640;ST;-6.136887;53.410078;28/07/2010;01/01/2036
1051515;BLYGAA02;07283;Ballymore Road 15 metres from PLP;9970;ST;-6.587544;53.1287;28/07/2010;01/01/2036
1051516;WILLPO01;00471;Rock Road Blackrock College;8810;ST;-6.191045;53.306869;28/07/2010;01/01/2036
1086414;CLIFRD02;02657;Clifden Road Le Fanu Park;10140;ST;-6.361747;53.341313;28/07/2010;01/01/2036
1030262;LMKLGR01;01108;Limekiln Road St. Peter's School;9110;ST;-6.328973;53.304569;28/07/2010;01/01/2036
1045896;CMLNVL02;02319;St. Agnes Road Garda Station;2330;ST;-6.315105;53.319505;28/07/2010;01/01/2036
1086346;BWNOGE04;02145;Deansrath St. Ronan's Church;790;ST;-6.424586;53.323119;28/07/2010;01/01/2036
1051453;SBCLRP02;06085;Link Road Deansgrange Road;6072;ST;-6.165848;53.286407;28/07/2010;01/01/2036
1005714;BMNTHL06;00254;Beaumont Hospital Main entrance;820;ST;-6.224098;53.390264;28/07/2010;01/01/2036
1051410;COLYLA02;07288;Crowleys Lane at Picnic area opp PLP98778;9950;ST;-6.576264;53.129419;28/07/2010;01/01/2036
1051414;BELRDJ01;02364;Belgard Road Belgard Retail Park;9390;ST;-6.36929;53.293635;28/07/2010;01/01/2036
1009885;STILNL01;00769;Stillorgan Road Belfield Court;7870;ST;-6.221317;53.311894;28/07/2010;01/01/2036
1003875;SWRDSS02;01625;Swords Road Morton Stadium;8150;ST;-6.24328;53.40109;28/07/2010;01/01/2036
1030274;LMKLGR02;01103;Limekiln Road Tymon Park;9110;ST;-6.329314;53.304524;28/07/2010;01/01/2036
1013769;GRANGE02;00730;Grange Road Hole in the Wall Road;3430;ST;-6.1618;53.398162;28/07/2010;01/01/2036
1086321;STJMHP04;01942;James Street St. James Hospital;7610;ST;-6.294611;53.342252;28/07/2010;01/01/2036
1030251;FELTHA02;06312;Holywell Link Road;10700;ST;-6.21139;53.443462;10/08/2010;01/01/2036
1013471;FRJCRR02;00788;Forest Road Rathingle Cottages;8092;ST;-6.240955;53.445847;28/07/2010;01/01/2036
1030289;CRCHRD01;00584;Howth Road Methodist Church;1690;ST;-6.105185;53.389894;28/07/2010;01/01/2036
1051473;TLGHFB02;02553;Tallaght Road M50 Flyover;8220;ST;-6.333788;53.28968;28/07/2010;01/01/2036
1009881;RTBLRD01;03884;Rathbeale Road Pine Grove Park;6795;ST;-6.234735;53.464599;28/07/2010;01/01/2036
1051475;MERNVH01;00478;Merrion Road St. Vincent's Hospital;5380;ST;-6.211264;53.318107;28/07/2010;01/01/2036
1086475;INCKCC02;02640;Inchicore Road Kilmainham Jail;10130;ST;-6.309997;53.342088;28/07/2010;01/01/2036
1045888;CMLNBD01;02187;Crumlin Road Iveagh Grounds;2300;ST;-6.307261;53.328038;28/07/2010;01/01/2036
1013674;CAPAHP02;01579;Cappagh Road Cappagh Hospital;1430;ST;-6.323713;53.393521;10/08/2010;01/01/2036
1136112;DBTENS02;03723;Donabate National School;2500;ST;-6.135407;53.492557;01/01/1970;01/01/2036
1136080;NBGRBG01;03746;Hearse Road Newbridge House;5940;ST;-6.176817;53.48172;01/01/1970;01/01/2036
1136098;NBGRBG02;03719;Hearse Road Newbridge House;5940;ST;-6.177236;53.481908;01/01/1970;01/01/2036
1136100;NBGRFL01;03745;Hearse Road Newbridge House;5950;ST;-6.163449;53.480216;01/01/1970;01/01/2036
1136128;AMGHRD01;02467;Cashel Road Health Centre;170;ST;-6.303915;53.319232;01/01/1970;01/01/2036
1051426;BMUNRD02;00323;Ballymun Road Silloge Golf Club;10460;ST;-6.265437;53.41292;10/08/2010;01/01/2036
1001458;THOMFS01;02001;High Street St. Audeon's Church;8360;ST;-6.273649;53.343307;09/09/2010;01/01/2036
1013481;NTLYLN02;02088;Nutley Lane St. Vincent's Hospital;6200;ST;-6.216074;53.317293;19/09/2010;01/01/2036
1193050;ADMSTR04;02225;Adamstown Road St. Patrick's Church;60;ST;-6.450081;53.349471;01/01/1970;01/01/2036
1193138;WESTMT02;04820;Westmanstown Garda Club;8720;ST;-6.439161;53.379587;01/01/1970;01/01/2036
1193088;STBTER02;01648;Stoneybatter Arbour Place;7930;ST;-6.282784;53.351088;01/01/1970;01/01/2036
1193089;BSWNHP02;02294;Mill Road Blanchardstown Hospital;1050;ST;-6.370307;53.389838;01/01/1970;01/01/2036
1193016;STBTER01;01713;Manor Street Stanhope Street Convent;7930;ST;-6.283309;53.351906;01/01/1970;01/01/2036
1045902;CKSTDO01;02379;Cork Street Marion Villas;9280;ST;-6.284633;53.337836;31/10/2010;01/01/2036
1193117;ASTRBT02;01666;Navan Road Ashtown Roundabout;210;ST;-6.330579;53.371586;01/01/1970;01/01/2036
1165355;GRENIH02;06003;Boot Road Green Isle Hotel;3440;ST;-6.403648;53.309992;31/10/2010;01/01/2036
1064609;DBRK1:2-1;DBRK1:2-1;DBRK1:2-1;;DT;-6.231275;53.31729;31/10/2010;01/01/2036
1165376;KCRBRY02;03383;Nangor Road Kilcarberry;4080;ST;-6.445485;53.318478;31/10/2010;01/01/2036
1136136;DBTESN02;03720;Donabate Railway Station;2510;ST;-6.151183;53.485372;31/10/2010;01/01/2036
1064617;DBRK1:2-2;DBRK1:2-2;DBRK1:2-2;;DT;-6.232604;53.318471;31/10/2010;01/01/2036
1193166;WESTMT01;04826;Westmanstown Garda Club;8720;ST;-6.439346;53.379545;01/01/1970;01/01/2036
1211659;WTONQT01;01476;Wolfe Tone Quay Ellis Street;5340;ST;-6.284664;53.347003;01/01/1970;01/01/2036
1193076;DBRK1:2;DBRK1:2;DBRK1:2;;DT;-6.2319395;53.3178805;21/11/2010;01/01/2036
1229373;FHILRD02;02214;Lucan Road Clarion Hotel;3130;ST;-6.399918;53.356089;01/01/1970;01/01/2036
1001397;PHIB:2;PHIB:2;PHIB:2;;DT;-6.2744645;53.3533905;21/11/2010;01/01/2036
1030201;REND:2;REND:2;REND:2;;DT;-6.23380966666667;53.34206;21/11/2010;01/01/2036
1229334;STLMHP02;02215;Lucan Road St. Loman's Hospital;7690;ST;-6.409277;53.358303;01/01/1970;01/01/2036
1229351;SALSCG02;03912;Maynooth Road Salesian College;7180;ST;-6.551695;53.359074;01/01/1970;01/01/2036
1229353;CTONRD01;03983;Maynooth Road Carton House;1490;ST;-6.552681;53.378015;01/01/1970;01/01/2036
1003792;HARS:2;HARS:2;HARS:2;;DT;-6.2777205;53.4166635;21/11/2010;01/01/2036
1005696;SKSTN:2;SKSTN:2;SKSTN:2;;DT;-6.118932;53.574325;21/11/2010;01/01/2036
1229336;CTONRD02;03968;Maynooth Road Carton Road;1490;ST;-6.553968;53.377947;01/01/1970;01/01/2036
1013716;CTARF:2;CTARF:2;CTARF:2;;DT;-6.190832;53.3585075;21/11/2010;01/01/2036
1247051;LCANHL03;02231;Lucan Hill St. Andrew's School;4890;ST;-6.439295;53.36004;01/01/1970;01/01/2036
1247107;ATGRPK04;04612;Esker Road Arthur Griffith Park;180;ST;-6.442446;53.347447;01/01/1970;01/01/2036
1247120;MERROW01;00748;Merrion Row Huguenot Cemetery;5385;ST;-6.255004;53.338513;01/01/1970;01/01/2036
1051578;BLMEUS01;07289;Ballymore Eustace Main Street;10010;ST;-6.614839;53.133403;19/12/2010;01/01/2036
1051403;BRGANO01;07251;Baltinglass Road Blessington;9910;ST;-6.537068;53.167689;19/12/2010;01/01/2036
1051517;VLYMNT02;07268;Ballyknockan At Village;10060;ST;-6.498872;53.106161;19/12/2010;01/01/2036
1051474;FTRBED02;07278;Ballymore Eustace Junction Plunkett Road;10000;ST;-6.610552;53.132463;19/12/2010;01/01/2036
1064614;DBRK2:2-2;DBRK2:2-2;DBRK2:2-2;;DT;-6.232604;53.318471;24/01/2011;01/01/2036
1257985;CHRLEM01;02903;Charlemont Street Charlemont Flats;10110;ST;-6.262492;53.33197;01/01/1970;01/01/2036
1258047;STEPBN01;03473;Kilgobbin Heights Inver House;7770;ST;-6.214398;53.254113;01/01/1970;01/01/2036
1211653;CHERWD01;05047;Wyattville Road Druid Valley;1670;ST;-6.140155;53.245812;24/01/2011;01/01/2036
1258054;CHRLEM02;02812;Charlemont Street Mercer Charlotte House;10110;ST;-6.262218;53.331926;01/01/1970;01/01/2036
1257960;RATBAL02;05144;Ratoath Road Marian School;10440;ST;-6.306181;53.372702;01/01/1970;01/01/2036
1211633;SGNABR03;03554;Shanganagh Road Shanganagh Bridge;7410;ST;-6.121708;53.242896;24/01/2011;01/01/2036
1211611;DBRK2:2;DBRK2:2;DBRK2:2;;DT;-6.2319395;53.3178805;24/01/2011;01/01/2036
1064607;DBRK2:2-1;DBRK2:2-1;DBRK2:2-1;;DT;-6.231275;53.31729;24/01/2011;01/01/2036
1211590;KILLNE02;02017;Stillorgan Road Foxrock Church;4200;ST;-6.175003;53.27419;24/01/2011;01/01/2036
1311861;AMGHRD05;02466;Armagh Road Scoil Colm;170;ST;-6.306431;53.320653;01/01/1970;01/01/2036
1311948;FRRYLE02;03510;Furry Lane Ballybrack Road;10830;ST;-6.225527;53.221011;01/01/1970;01/01/2036
1005669;WTLORD03;00781;Waterloo Road St. Martins House;8650;ST;-6.243723;53.332637;30/01/2011;01/01/2036
1311960;FRACTI03;03083;Frascati Road Frascati Shop Centre;10200;ST;-6.181002;53.301232;01/01/1970;01/01/2036
1311961;CYFTA01;03196;Newtown Park Rushmore House;4521;ST;-6.177212;53.287383;01/01/1970;01/01/2036
1311962;ROEBRD02;00863;Roebuck Road Carmelites Monastery;7090;ST;-6.231916;53.302668;01/01/1970;01/01/2036
1211612;BKRSCR02;04565;Kill Avenue Rosepark;260;ST;-6.155142;53.281337;30/01/2011;01/01/2036
1312062;CTCRA02;03166;Carysfort Avenue Prince Edward Terrace;4523;ST;-6.180505;53.297065;01/01/1970;01/01/2036
1312070;CTPSA02;03168;Carysfort Avenue Proby Square;4522;ST;-6.180057;53.29224;01/01/1970;01/01/2036
1311925;STMYRD02;02317;St. Mary's Road Crumlin Bowling Club;7650;ST;-6.318852;53.323408;01/01/1970;01/01/2036
1329926;SHKLCH02;03138;Bray Road St. Anne's Church;7440;ST;-6.124723;53.234349;01/01/1970;01/01/2036
1329928;LOGHHP01;03143;Bray Road Loughlinstown Hospital;4770;ST;-6.130766;53.242651;01/01/1970;01/01/2036
1329921;CKINLN02;04125;Bray Road Shanganagh Castle;2240;ST;-6.123593;53.223421;01/01/1970;01/01/2036
1329943;BRAYRD02;03148;Bray Road Shrewsbury House;1180;ST;-6.146562;53.258749;01/01/1970;01/01/2036
1339088;GYSTST04;04227;Greystones Rugby Club;3470;ST;-6.066368;53.135321;01/01/1970;01/01/2036
1329961;HBRTRD02;02963;Herbert Road Killarney Heights;3620;ST;-6.127136;53.194528;01/01/1970;01/01/2036
1329962;CKINCH02;04127;Bray Road Crinken Church;2230;ST;-6.119863;53.218751;01/01/1970;01/01/2036
1339080;KBRDLE02;02964;Kilbride Lane Herbert Park;4070;ST;-6.129012;53.191551;01/01/1970;01/01/2036
1064612;BRAY:2-1;BRAY:2-1;BRAY:2-1;;DT;-6.098885;53.203315;20/02/2011;01/01/2036
1329956;CKINLN01;04205;Bray Road Crinken Lodge;2240;ST;-6.12487;53.224532;01/01/1970;01/01/2036
1329957;EPLNBY04;04139;Boghall Road Woodbrook Lawn;2880;ST;-6.111822;53.188237;01/01/1970;01/01/2036
1339121;NCSTWW01;04656;Newtownmountkennedy Newcastle Hospital;5960;ST;-6.100447;53.079487;01/01/1970;01/01/2036
1339093;WEXFRD02;04650;Wexford Road Mount Kennedy Demesne;11011;ST;-6.105221;53.110255;01/01/1970;01/01/2036
1352905;BLYWTM05;04533;Kilmacanogue Rock Valley;700;ST;-6.13653;53.169538;01/01/1970;01/01/2036
1352918;BLYWTM06;06000;Kilmacanogue Rock Valley;700;ST;-6.136472;53.170437;01/01/1970;01/01/2036
320001;320001;01918;Meath Street Junction Hanbury Lane;3200;S;-6.279147;53.34221;29/05/2011;01/01/2036
1013787;BMUNLB02;00092;Ballymun Road Ballymun Library;590;ST;-6.26466;53.389833;29/05/2011;01/01/2036
1013554;CLGRGL01;06319;Clongriffin Near Rail Station;1742;ST;-6.153786;53.402655;29/05/2011;01/01/2036
1051449;BMUNSA02;06182;Ballymun Road Santry Cross;10511;ST;-6.265352;53.40225;29/05/2011;01/01/2036
1051406;BMUNTR02;00028;Ballymun Road Glasnevin Tennis Club;640;ST;-6.265989;53.381575;29/05/2011;01/01/2036
1165344;NCSTBN06;03399;Newcastle Newcastle Manor;10250;ST;-6.491994;53.296055;29/05/2011;01/01/2036
1393045;RATHDR02;04288;Rathdown Road National School;6805;ST;-6.074915;53.149196;01/01/1970;01/01/2036
320002;320002;04853;Francis Street Junction Dean Swift Square;3200;S;-6.275357;53.342213;29/05/2011;01/01/2036
279002;279002;04859;Eccles Street Mater Hospital;2790;S;-6.266602;53.358225;29/05/2011;01/01/2036
674002;674002;00061;Quarry Road Junction Leix Road;6740;S;-6.290335;53.362231;29/05/2011;01/01/2036
674001;674001;00076;Quarry Road Junction Leix Road;6740;S;-6.29018;53.362161;29/05/2011;01/01/2036
260003;260003;01422;Drimnagh Road Our Lady's Hospital for Sick Children;2600;S;-6.319364;53.32492;29/05/2011;01/01/2036
279001;279001;04852;Eccles Street Mater Private Hospital;2790;S;-6.265577;53.358103;29/05/2011;01/01/2036
1258080;DLRECR03;04983;Marine Road Town Hall;2660;ST;-6.134301;53.294078;29/05/2011;01/01/2036
175002;175002;01389;Clogher Road St. Bernadette's Church;1750;S;-6.295439;53.326085;29/05/2011;01/01/2036
1051495;MERNGT02;00424;Merrion Road Merrion Gates;5360;ST;-6.203712;53.31539;29/05/2011;01/01/2036
1051497;BTONST01;00819;Blessington Street Blessington Court;1080;ST;-6.265978;53.356298;29/05/2011;01/01/2036
1193025;BSWNSC03;07026;Blanchardstown Shopping Centre;1030;ST;-6.392111;53.393885;29/05/2011;01/01/2036
1136065;TYRREL01;07073;Tyrrelstown Carlton Hotel;4505;ST;-6.378352;53.419102;24/07/2011;01/01/2036
1136117;TYRREL02;07072;Tyrrelstown Carlton Hotel;4505;ST;-6.378161;53.419284;24/07/2011;01/01/2036
692501;692501;04505;Ratoath Road St. Vincent Deaf;6925;S;-6.299079;53.364185;24/07/2011;01/01/2036
1003824;KELYCR01;01350;Harrington Street St. Kevin's Church;3940;ST;-6.267474;53.332559;07/08/2011;01/01/2036
1136085;DUBERX01;01557;St. Margaret's Road M50 Flyover;2640;ST;-6.300691;53.407711;07/08/2011;01/01/2036
1193071;SNRDCC01;02338;Snugborough Road Garnish Square;1441;ST;-6.377972;53.393082;21/08/2011;01/01/2036
1165339;KCRBRY01;03416;Nangor Road Kilcarberry Park;4080;ST;-6.441425;53.318149;07/08/2011;01/01/2036
1051483;PSQE-PM;07457;Parnell Square East Junction Great Denmark Street [Virtual Stop Test];6475;ST;-6.263117;53.354285;21/08/2011;01/01/2036
353001;353001;00648;Brookwood Rise Junction Brookwood Avenue;3530;S;-6.195783;53.377552;11/09/2011;01/01/2036
612004;612004;01236;Barryscourt Road Opposite Colaiste Dhulaigh;6120;S;-6.210998;53.39628;11/09/2011;01/01/2036
353002;353002;04787;Brookwood Avenue Junction Howth Road;3530;S;-6.195083;53.375986;11/09/2011;01/01/2036
1136060;DBTENS01;03741;Donabate National School;2500;ST;-6.136264;53.492494;02/10/2011;01/01/2036
1001446;NEPHRD02;04498;Nephin Road St. Declan's School;5910;ST;-6.304162;53.366829;13/11/2011;01/01/2036
1258016;HEUSST05;04320;Heuston Station Front of Station;10180;ST;-6.291976;53.346612;02/10/2011;01/01/2036
1257996;STJDGC01;04578;Wellington Lane St. Jude's GAA Club;7640;ST;-6.326068;53.297547;13/11/2011;01/01/2036
1136135;DUBERX02;01550;St. Margaret's Road M50 Flyover;2640;ST;-6.300691;53.407518;13/11/2011;01/01/2036
390001;390001;04780;Jamestown Road Junction Clancy Avenue;3900;S;-6.295683;53.393163;27/11/2011;01/01/2036
1051503;SBCLRP01;06086;Link Road Deansgrange Road;6072;ST;-6.165994;53.286362;13/11/2011;01/01/2036
102002;102002;04464;Blakestown Way Sheepmoor Grove;1020;S;-6.399063;53.394019;27/11/2011;01/01/2036
390002;390002;04789;Jamestown Road Junction Clancy Avenue;3900;S;-6.29577;53.392753;27/11/2011;01/01/2036
1051478;WHITEW01;07122;Whitestown Way Football Stadium;70;ST;-6.374836;53.282622;13/11/2011;01/01/2036
1086388;SMNTJC03;00381;Park Avenue St. John's Church;7330;ST;-6.212297;53.324195;27/11/2011;01/01/2036
299002;299002;01568;Wellmount Road Junction Farnham Drive;2990;S;-6.299856;53.387;01/01/1970;01/01/2036
648002;648002;00285;Parnell Street Junction Parnell Place (Stop PU);6480;S;-6.260448;53.353132;01/01/1970;01/01/2036
393001;393001;01057;Lower Churchtown Rd Junction Orwell Road;3930;S;-6.252931;53.299603;27/11/2011;01/01/2036
308502;308502;05002;Northern Cross Business Park N2 Finglas;3085;S;-6.315092;53.398025;01/01/1970;01/01/2036
7002;07002;07002;Airside Retail Park Junction Dublin Road;107002;S;-6.227228;53.444928;30/11/2011;01/01/2036
2926;02926;02926;Edmondstown Road Good Council Centre;102926;S;-6.297415;53.281704;30/11/2011;01/01/2036
1642;01642;01642;Swords Road Whitehall Church;101642;S;-6.2436;53.384;30/11/2011;01/01/2036
1136;01136;01136;Anne Devlin Park Church Of The Holy Spirit;101136;S;-6.299184;53.289495;30/11/2011;01/01/2036
7035;07035;07035;Rossmore Road Junction Lough Conn Drive;107035;S;-6.353998;53.347774;30/11/2011;01/01/2036
5107;05107;05107;Kerrymount Avenue Junction Claremont Road;105107;S;-6.172096;53.260267;30/11/2011;01/01/2036
4351;04351;04351;Newtown Park Avenue Opposite Marian Park Estate;104351;S;-6.175296;53.288576;30/11/2011;01/01/2036
2951;02951;02951;Taylor's Lane Opposite Pearse Brothers Park;102951;S;-6.287132;53.281558;30/11/2011;01/01/2036
7046;07046;07046;Ashtown Village Junction River Road;107046;S;-6.3325;53.376492;30/11/2011;01/01/2036
103002;103002;04815;Blanchardstown Centre Blanchardstown;1030;S;-6.39163;53.394154;27/11/2011;01/01/2036
1024002;1024002;00868;Mather Road North Junction North Avenue;10240;S;-6.213395;53.300022;27/11/2011;01/01/2036
7033;07033;07033;Rossmore Road Junction Drumfinn Road;107033;S;-6.357199;53.349182;30/11/2011;01/01/2036
5116;05116;05116;Kilcock Allen Bridge;105116;S;-6.680279;53.405508;30/11/2011;01/01/2036
506;00506;00506;Clonliffe Road Opposite Jones's Road;100506;S;-6.251036;53.362517;30/11/2011;01/01/2036
3721;03721;03721;Donabate Corballis Cross;103721;S;-6.148481;53.48717;30/11/2011;01/01/2036
2973;02973;02973;Bray Station Set Down  Stop;102973;S;-6.101213;53.204771;30/11/2011;01/01/2036
517;00517;00517;North Strand R0Ad Health Centre;100517;S;-6.245713;53.355665;30/11/2011;01/01/2036
3097;03097;03097;Killiney Road Wyvern Estate;103097;S;-6.115057;53.269916;30/11/2011;01/01/2036
7068;07068;07068;Grange Road The Priory;107068;S;-6.281021;53.284652;30/11/2011;01/01/2036
7071;07071;07071;St. Helena's Road Junction St. Helena's Drive;107071;S;-6.297635;53.380701;30/11/2011;01/01/2036
4506;04506;04506;Ratoath Road Junction Nephin Road;104506;S;-6.301577;53.366026;30/11/2011;01/01/2036
5158;05158;05158;Grange Road Jct Grange Abbey Grove;105158;S;-6.15379;53.398194;30/11/2011;01/01/2036
7097;07097;07097;Tyrrelstown French Park;107097;S;-6.384716;53.420252;30/11/2011;01/01/2036
5172;05172;05172;Wynnward Drive A.I.B.;105172;S;-6.2364;53.307921;30/11/2011;01/01/2036
848002;848002;00440;Redesdale Road Junction Thornhill Road;8480;S;-6.215976;53.290206;27/11/2011;01/01/2036
542001;542001;01059;Lower Churchtown Rd Milltown Golf Course;5420;S;-6.251574;53.302914;27/11/2011;01/01/2036
819005;819005;04345;Tallaght The Square Shopping Centre;8190;S;-6.372584;53.285738;27/11/2011;01/01/2036
2960;02960;02960;Blanchardstown Shopping Centre;102960;S;-6.388454;53.394248;30/11/2011;01/01/2036
504;00504;00504;Clonliffe Road Junction Drumcondra Road;100504;S;-6.256226;53.363127;30/11/2011;01/01/2036
2982;02982;02982;Taylor's Lane Junction Whitechurch Road;102982;S;-6.285394;53.281643;30/11/2011;01/01/2036
7095;07095;07095;Northwest Business P Junction Corduff Road;107095;S;-6.348162;53.411427;30/11/2011;01/01/2036
5170;05170;05170;Wynnsward Drive Junction Clonskeagh Road;105170;S;-6.236424;53.308032;30/11/2011;01/01/2036
7213;07213;07213;St. Margarets Road at house numbe 179;107213;S;-6.284853;53.406197;30/11/2011;01/01/2036
5183;05183;05183;Adamstown Link Road Near Adamstown Avenue;105183;S;-6.453086;53.335667;30/11/2011;01/01/2036
1855;01855;01855;Snugborough Rd Ext. Opposite Coolmine Estate;101855;S;-6.398964;53.385633;30/11/2011;01/01/2036
3266;03266;03266;Mart Lane St. Brigid's School;103266;S;-6.17017;53.269316;30/11/2011;01/01/2036
1866;01866;01866;Huntstown Way Ashfield Park;101866;S;-6.402675;53.399825;30/11/2011;01/01/2036
2625;02625;02625;Cheeverstown Road Junction Fettercairn Road;102625;S;-6.399645;53.288321;30/11/2011;01/01/2036
7037;07037;07037;Rossmore Road Ballyfermot Opposite Boundary Wall of Nos. 54-56;107037;S;-6.355904;53.345906;30/11/2011;01/01/2036
382;00382;00382;St. John's Road Seamount House;100382;S;-6.20763;53.325093;30/11/2011;01/01/2036
1149;01149;01149;Scholarstown Road St. Colmcille's Community School;101149;S;-6.315701;53.27938;30/11/2011;01/01/2036
4364;04364;04364;Cappagh Road Mater Christi School;104364;S;-6.321934;53.392643;30/11/2011;01/01/2036
508;00508;00508;Clonliffe Road Opposite Distillery Road;100508;S;-6.249128;53.362161;30/11/2011;01/01/2036
5181;05181;05181;Adamstown Adamstown Link Road;105181;S;-6.444677;53.335156;30/11/2011;01/01/2036
577;00577;00577;Harbour Road Old Courthouse;100577;S;-6.070151;53.388158;30/11/2011;01/01/2036
4540;04540;04540;Farnham Drive Opposite Erins Isle GAA Club;104540;S;-6.300384;53.384415;30/11/2011;01/01/2036
1864;01864;01864;Huntstown Way Sacred Heart Church;101864;S;-6.410361;53.401812;30/11/2011;01/01/2036
580;00580;00580;Howth Road Transport Museum;100580;S;-6.079619;53.388769;30/11/2011;01/01/2036
3297;03297;03297;Mart Lane Brynogue;103297;S;-6.173037;53.269708;30/11/2011;01/01/2036
731;00731;00731;Thormanby Road Brackenhill House;100731;S;-6.062973;53.365815;30/11/2011;01/01/2036
214;00214;00214;Swords Road Highfield Hospital;100214;S;-6.246649;53.379309;30/11/2011;01/01/2036
742;00742;00742;Raheny Road De La Salle School;100742;S;-6.169837;53.389821;30/11/2011;01/01/2036
3743;03743;03743;Donabate Corballis Cross;103743;S;-6.148487;53.486745;30/11/2011;01/01/2036
7093;07093;07093;Rosemount Park Road Junction Rosemount Park Drive;107093;S;-6.354264;53.403883;30/11/2011;01/01/2036
3790;03790;03790;Skerries Road Pierstown Lane;103790;S;-6.102575;53.558629;30/11/2011;01/01/2036
1873;01873;01873;Huntstown Way Huntstown Green;101873;S;-6.410212;53.401703;30/11/2011;01/01/2036
7244;07244;07244;Clongriffin Main Street Junction Grange Lodge Avenue;107244;S;-6.154642;53.402833;30/11/2011;01/01/2036
143005;143005;01561;Cappagh Hospital Entrance To Hospital;1430;S;-6.326486;53.393802;27/11/2011;01/01/2036
764;00764;00764;Stillorgan Road Belfield Slip Road;100764;S;-6.217801;53.30983;30/11/2011;01/01/2036
2818;02818;02818;Dundrum Road Emmet House;102818;S;-6.246405;53.307942;30/11/2011;01/01/2036
258;00258;00258;Grace Park Road Junction Sion Hill Road;100258;S;-6.242373;53.375726;30/11/2011;01/01/2036
2091;02091;02091;Anglesea Road Junction Ailesbury Drive;102091;S;-6.230318;53.322;30/11/2011;01/01/2036
163;00163;00163;Ballygall Road East Junction Ferndale Avenue;100163;S;-6.27962;53.387147;30/11/2011;01/01/2036
7346;07346;07346;Cruiserath Road (proposed) Opposite Upper Deck Restaurant;107346;S;-6.368458;53.409941;30/11/2011;01/01/2036
663;00663;00663;Collins Avenue East St. Peter's School;100663;S;-6.217048;53.374768;30/11/2011;01/01/2036
3350;03350;03350;Sybil Hill Road Health Centre;103350;S;-6.194359;53.369866;30/11/2011;01/01/2036
7329;07329;07329;Feltrim Lane Kettles Lane;107329;S;-6.192992;53.440542;30/11/2011;01/01/2036
1961;01961;01961;Naas Road Moran's Hotel;101961;S;-6.36285;53.319716;30/11/2011;01/01/2036
157;00157;00157;Glasilawn Road Griffith Road;100157;S;-6.281625;53.380413;30/11/2011;01/01/2036
685;00685;00685;St. Fintans Road Sutton Park School;100685;S;-6.094829;53.375408;30/11/2011;01/01/2036
160;00160;00160;Griffith Parade Junction Fitzmaurice Road;100160;S;-6.279304;53.382754;30/11/2011;01/01/2036
171;00171;00171;Ballygall Road East Opposite Church;100171;S;-6.276691;53.383978;30/11/2011;01/01/2036
4678;04678;04678;Cherrywood Crescent Junction Cherrywood Villas;104678;S;-6.140119;53.245859;30/11/2011;01/01/2036
1031;01031;01031;Lower Churchtown Rd Windy Arbour Luas Station;101031;S;-6.250885;53.301635;30/11/2011;01/01/2036
